lt_no,yr,title,lt
23025,2014,[<h3 class=bold>What should you do?</h3>],"[<p class=options><a href=/edgar/searchedgar/companysearch.html tabindex=6>Company Filings</a> | <a href=/search/search.htm tabindex=7>More Search Options</a>, Were sorry, but the page youre looking for might have been removed, had its name changed, or is temporarily unavailable., To report a broken link, please email <a href=mailto:webmaster@sec.gov?subject=Broken link:%20>webmaster@sec.gov</a>.                                        <br/>We regret any inconvenience, and we thank you for your interest in the SEC website. , <p class=italic text-right row id=ssi-modified>Modified: Sept. 11, 2015, <p class=title data-section-title=><a href=/index.htm>U.S. Securities and Exchange Commission</a>, <p class=title data-section-title=><a href=/News/Page/Landing/Page/1356125649504>Newsroom</a>, <p class=title data-section-title=><a href=#> RSS Feeds</a>, <p class=title data-section-title=><a href=#> Social Media</a>, <p class=options><a href=/edgar/searchedgar/companysearch.html>Company Filings</a> | <a href=/search/search.htm>More Search Options</a>]"
23027,2014,[<h3>District Court Enters Final Judgment of Disgorgement and Prejudgment Interest Against Defendant Lance T. Berger</h3>],"[The Commission announced that on May 22, 2014, the United States District Court for the Southern District of Florida entered a Final Judgment of Disgorgement and Prejudgment Interest by consent against Defendant Lance T. Berger in the amount of $5,151.76, pursuant to Section 21(d) of the Securities Exchange Act of 1934 (Exchange Act)., The Final Judgment follows a previous order by United States District Judge William J. Zloch in which the Court entered a Judgment of Permanent Injunction and Other Relief by consent against Berger, enjoining him from violations of Section 10(b) of the Exchange Act and Exchange Act Rule 10b-5(a) and (c), and permanently barring him from participating in an offering of penny stock., The Commission commenced this action by filing its Complaint on September 27, 2013 against Berger, alleging he engaged in a fraudulent scheme concerning the stock of Face Up Entertainment Group, Inc. (FUEG).  The scheme involved illicit kickbacks and timed press releases designed to falsely generate the appearance of market interest in FUEG, induce public purchases of the stock, and artificially increase its trading volume and price.,  , <i>http://www.sec.gov/litigation/litreleases/2014/lr23027.htm</i><br/>]"
23028,2014,"[<h3>District Court Enters Final Judgment Setting a Civil Penalty in the Amount of $35,000 Against Defendant Mark Balbirer</h3>]","[The Commission announced that on March 21, 2014, the United States District Court for the Southern District of Florida entered a Final Judgment setting a civil penalty in the amount of $35,000 against Defendant Mark Balbirer, pursuant to Section 20(d) of the Securities Act of 1933 (Securities Act) and Section 21(d) of the Securities Exchange Act of 1934 (Exchange Act)., The Final Judgment follows a previous order by United States District Judge Daniel T.K. Hurley in which the Court entered a Judgment of Permanent Injunction and Other Relief against Balbirer, enjoining him from violations of Section 17(a)(1) of the Securities Act, Section 10(b) of the Exchange Act and Exchange Act Rule 10b-5(a), and permanently barring him from participating in an offering of penny stock., The Commission commenced this action by filing its Complaint on August 14, 2013. The Complaint alleged Balbirer engaged in a fraudulent scheme involving the stock of a privately held company, So. Florida Film Fund, Inc., illicit kickbacks, and phony agreements to mask those kickbacks., For more information on earlier actions in this case, see Litigation Release No. <a href=/litigation/litreleases/2013/lr22780.htm>22780</a> (August 14, 2013).,  , <i>http://www.sec.gov/litigation/litreleases/2014/lr23028.htm</i><br/>]"
23029,2014,"[<h3>District Court Enters Final Judgment Setting a Civil Penalty in the Amount of $28,000 Against Defendant Health Sciences Group, Inc.</h3>]","[The Commission announced that on March 10, 2014, the United States District Court for the Southern District of Florida entered a Final Judgment setting a civil penalty in the amount of $28,000 against Defendant Health Sciences Group, Inc. (HESG), pursuant to Section 20(d) of the Securities Act of 1933 (Securities Act) and Section 21(d) of the Securities Exchange Act of 1934 (Exchange Act)., The Final Judgment follows a previous order by United States District Judge Robert N. Scola, Jr. in which the Court entered a Judgment of Permanent Injunction and Other Relief against HESG, enjoining the company from violations of Section 17(a)(1) of the Securities Act, Section 10(b) of the Exchange Act and Exchange Act Rule 10b-5(a)., The Commission commenced this action by filing its Complaint on August 14, 2013, against HESG and co-defendant, Thomas Gaffney. The Complaint alleged the defendants engaged in a fraudulent scheme involving HESGs stock, illicit kickbacks, and phony agreements to mask those kickbacks.  On November 20, 2013, the Court entered a Final Judgment of Permanent Injunction and Other Relief by consent against Gaffney, enjoining him from violations of Section 17(a)(1) of the Securities Act, Section 10(b) of the Exchange Act and Exchange Act Rule 10b-5(a), and permanently barring him from participating in an offering of penny stock, and from acting as an officer or director of any issuer that has a class of securities registered pursuant to Section 12 of the Exchange Act or that is required to file reports pursuant to Section 15(d) of the Exchange Act., For more information on earlier actions in this case, see Litigation Release Nos. <a href=/litigation/litreleases/2013/lr22780.htm>22780</a> (August 14, 2013) and <a href=/litigation/litreleases/2013/lr22883.htm>22883</a> (December 3, 2013).,  , <i>http://www.sec.gov/litigation/litreleases/2014/lr23029.htm</i><br/>]"
23030,2014,[<h3>Court Modifies and Extends Order Asset Freeze and Temporary Restraining Order</h3>],"[The Securities and Exchange Commission (the “SEC”) announced that, at the request of the parties, the Honorable Richard M. Berman, United States District Court Judge for the Southern District of New York, entered on June 19 and 20, 2014 two orders that modified and extended the order freezing assets, temporary restraining order, and granting other relief that the Court had entered on May 5, 2014., The first order, entered on June 19, 2014, extends until July 31, 2014 all of the relief that the Court had entered on May 5, 2014, including the asset freeze with respect to Vineet Kalucha and Aphelion Fund Management LLC (“Aphelion”). This order also reschedules, from July 10, 2014 to July 23, 2014, the hearing on the SEC’s application to show cause as to why the Court should not enter a preliminary injunction against each of the defendants., The second order, entered on June 20, 2014, modifies the asset freeze with respect to Aphelion by ordering a third party to liquidate into cash all securities held by Aphelion US Fund, LP (the “US Fund”) and Aphelion Offshore Fund, Ltd., and to transfer the cash proceeds into a bank account held in the name of the US Fund., On May 5, 2014, the SEC filed fraud charges and sought emergency relief against Aphelion, Aphelion’s chief investment officer, Vineet Kalucha, and Aphelion’s chief financial officer, George Palathinkal. The SEC’s complaint alleges that Kalucha fraudulently altered an outside audit firm’s report reviewing the performance of an investment account he managed, that Palathinkal allegedly learned about Kalucha’s falsifications, which essentially changed an investment loss into a major investment gain in the account, and that the falsified report showing the phony gain instead of the actual loss was distributed to prospective investors. The complaint further alleges that investors were separately provided false information about Aphelion’s assets under management and Kulucha’s litigation history, and that Kalucha allegedly siphoned investor proceeds for his luxury car payments and settlements of legal actions against him personally that are unrelated to Aphelion.,  , <i>http://www.sec.gov/litigation/litreleases/2014/lr23030.htm</i>, ]"
23031,2014,[<h3>SEC Charges Former Brokers with Trading Ahead of IBM-SPSS Acquisition</h3>],"[The Securities and Exchange Commission today announced it has charged two additional brokers with trading on inside information ahead of the $1.2 billion acquisition of SPSS Inc. in 2009 by IBM Corporation., The SEC alleged that former brokers Benjamin Durant III and Daryl M. Payton illegally traded on a tip about the acquisition from Thomas C. Conradt, a friend and fellow broker in the New York office of a Connecticut-based broker-dealer.  The SEC complaint, filed in federal court in Manhattan, seeks return of alleged ill-gotten trading gains of approximately $300,000, with interest, financial penalties, and permanent injunctions., In a parallel action, the U.S. Attorneys Office for the Southern District of New York today announced criminal charges against Durant and Payton., The SEC previously charged that Conradt and David J. Weishaus, another fellow broker and tippee, traded on confidential information that Conradt received from his roommate, Trent Martin, a research analyst who misappropriated it from an attorney working on the transaction.  Martin, Conradt, and Weishaus settled with the SEC and pled guilty last year to related criminal charges in the matter., According to the SECs complaint, in a private meeting with Martin, his attorney friend revealed nonpublic information about the acquisition, including the names of the companies and the anticipated transaction price.  The lawyer expected Martin to keep the information in confidence and refrain from trading on it but instead, Martin traded and tipped Conradt, who traded and tipped Durant and Payton, among others.  The SEC further alleges that on the day that IBMs acquisition of SPSS was publicly announced, Durant, Payton, and others met at a Manhattan hotel room and discussed what to do if law enforcement officials contacted them about their trading in SPSS securities., The SECs continuing investigation is being conducted by Scott A. Thompson, A. Kristina Littman, and John S. Rymas.  G. Jeffrey Boujoukos and Catherine E. Pappas are handling the litigation.  All are with the SECs Philadelphia Regional Office., The SEC acknowledges the assistance of the Options Regulatory Surveillance Authority (ORSA), the U.S. Attorneys Office for the Southern District of New York, and the Federal Bureau of Investigation., For further information, see Litigation Release No. <a href=/litigation/litreleases/2012/lr22581.htm>22581</a> (December 26, 2012)., <img alt= border=0 height=9 src=/images/arrowright_dkblue.gif width=10/><a href=http://www.sec.gov/litigation/complaints/2014/comp-pr2014-124.pdf>SEC Complaint</a>,  , <i>http://www.sec.gov/litigation/litreleases/2014/lr23031.htm</i><br/>]"
23032,2014,[<h3>SEC Files Settled Charges Against Arizona Resident in Prime Bank Investment Scheme</h3>],"[On June 26, 2014, the Securities and Exchange Commission charged Cheryl L. Robinson with violating the antifraud and registration provisions of the federal securities laws in connection with an advance-fee high-yield investment scam perpetrated by Switzerland-based Malom Group AG (Malom) and Las Vegas-based M.Y. Consultants, Inc.  As alleged in the complaint, Robinson acted as a promoter who recruited investors for Malom Group AG and M.Y. Consultants, Inc. from approximately 2009 to 2011.  In this role, Robinson made materially false and misleading statements to investors about, among other things, Maloms background, its financial resources, and history of success.  She also failed to inform investors that none of her clients had received any profits from a transaction with Malom and that all had lost their entire investment.  Finally, she omitted to tell any of the investors that she would be paid approximately 25% of the investors advance fees regardless of whether a transaction produced profits.  The complaint also alleged that Robinson acted as an unregistered broker dealer and sold unregistered Malom securities.  By virtue of this conduct, the complaint alleges Robinson violated Sections 5(a), 5(c), and 17(a) of the Securities Act of 1933, Sections 10(b) and 15(a) of the Securities Exchange Act of 1934 and Rule 10b-5 thereunder; and aided and abetted violations of Securities Act Section 17(a) and Exchange Act Section 10(b) and Rule 10b-5., Without admitting or denying the SECs allegations, Robinson agreed to settle the case against her.  The settlement is pending final approval by the court.  Specifically, Robinson consented to the entry of a final judgment that (1) permanently enjoins her from future violations of Securities Act Sections 5(a), 5(c), and 17(a), Exchange Act Sections 10(b), 15(a), and Rule 10b-5 thereunder, and from aiding and abetting violations of Securities Act Section 17(a) and Exchange Act Section 10(b) and Rule 10b-5; (2) permanently enjoins her from directly or indirectly participating in the issuance, offer, or sale of any security, including but not limited to joint venture agreements, proofs of funds, bank guarantees, medium term notes, standby letters of credit, structured notes, and similar instruments, with the exception of the purchase or sale of securities listed on a national securities exchange; (3) orders that she is liable for disgorgement in the amount of $204,417 and $13,802 in prejudgment interest, for a total of $218,219, and waives that amount based on her demonstrated inability to pay.  The Commission also decided to forego a civil penalty based on her demonstrated financial condition., As part of the settlement, and following the entry of the proposed final judgment, Robinson, without admitting or denying the Commissions findings, has consented to the entry of a Commission order, pursuant to Exchange Act Section 15(b)(6), permanently barring her from association with any broker, dealer, investment adviser, municipal securities dealer, municipal advisor, transfer agent, or nationally recognized statistical rating organization, or from participating in an offering of penny stock. , The SEC previously charged Malom Group AG, its principals, and agents with violating the antifraud and securities registration provisions of the federal securities laws in SEC v. Malom Group AG, et al, 2:13-cv-2280 (D. Nev. Dec. 16, 2013), SEC v. Erwin et al., 2:14-cv-623 (D. Nev. Apr. 23, 2014), and SEC v. Smith, 1:14-cv-192 (D.N.H. May 2, 2014). For additional information about these cases, see Litigation Release Number <a href=/litigation/litreleases/2013/lr22890.htm>22890</a> (Dec. 16, 2013); Litigation Release Number <a href=/litigation/litreleases/2014/lr22978.htm>22978</a> (Apr. 28, 2014); and Litigation Release Number <a href=/litigation/litreleases/2014/lr22984.htm>22984</a> (May 2, 2014)., <img alt= border=0 height=9 src=/images/arrowright_dkblue.gif width=10/><a href=/litigation/complaints/2014/comp23032.pdf>SEC Complaint</a>,  , <i>http://www.sec.gov/litigation/litreleases/2014/lr23032.htm</i><br/>]"
23033,2014,[<h3>Court Enters Judgments Against China-Based Company and Senior Executive in Market Manipulation Scheme; Company Ordered to Pay $4.35 Million Penalty</h3>],"[The Securities and Exchange Commission announced today that on June 25, 2014, a Massachusetts federal court entered final judgments against China-based AutoChina International Limited and its senior executive Hui Kai Yan, defendants in a fraud action filed by the Commission in 2012.  The Commission alleged in its complaint that AutoChina and eleven investors, including Yan, orchestrated a market manipulation scheme to create the false appearance of a liquid and active market for AutoChinas stock.  Among other things, AutoChina has been ordered to pay a penalty of $4.35 million.  Yan has been ordered to pay a penalty of $150,000 and is barred from serving as an officer or director of a public company.  AutoChina and Yan each agreed to the entry of the final judgments., The Commissions enforcement action, filed April 11, 2012, alleged that AutoChina senior executive and director Yan and others fraudulently traded AutoChinas stock to boost its daily trading volume in order to create the appearance of liquidity of AutoChinas stock and thereby enhance the companys ability to get much-needed financing.  Starting in October 2010, the defendants and others deposited more than $60 million into U.S.-based brokerage accounts and engaged in hundreds of fraudulent trades over the next three months through these accounts and accounts with a Hong Kong-based broker-dealer.  The complaint alleged that the fraudulent trades included matched orders, where one account sold shares to another account at the same time and for the same price, and wash trades, which resulted in no change of beneficial ownership of the shares.  According to the complaint, AutoChina and the other defendants engaged in the scheme after lenders offered AutoChina unfavorable terms for a stock-backed loan due to low trading volume in its stock., The SEC complaint alleged that in the three months before the defendants opened the U.S.-based brokerage accounts, the average daily trading volume of AutoChinas stock was approximately 18,000 shares.  From November 1, 2010 through January 31, 2011, the average daily trading volume increased to more than 139,000 shares.  On some days, the defendants and related accounts trading accounted for as much as 70% of the trading of AutoChinas stock., The final judgment in the Commissions enforcement action enjoins AutoChina and Hui Kai Yan from violations of Section 17(a) of the Securities Act of 1933 and Sections 9(a)(1), 9(a)(2), and 10(b) of the Securities Exchange Act of 1934 and Rule 10b-5 thereunder, and orders AutoChina to pay a civil penalty of $4.35 million and Yan to pay a civil penalty of $150,000.  Yan was also barred permanently from acting an officer or director of a public company., The Commissions action remains pending against ten other defendants., For further information, see Lit. Release No. <a href=/litigation/litreleases/2012/lr22326.htm>22326</a> (April 11, 2012) [Complaint filed].,  , <i>http://www.sec.gov/litigation/litreleases/2014/lr23033.htm</i><br/>]"
23034,2014,"[<h3>District Court Enters Final Judgment Setting Disgorgement and Civil Penalties Against Hedge Fund Advisers Om Investment Management and Gignesh Movalia for Fabricating Statements of Shares in Facebook, Inc. and Making Unauthorized and Undisclosed Investments</h3>]","[The Commission announced that on May 29, 2014, the United States District Court for the Southern District of Florida entered a Final Judgment setting disgorgement in the amount of $1,729,800.04 against Defendants OM Investment Management LLC (“OMIM”) and Gignesh Movalia, jointly and severally, and a civil penalty in the amount of $300,000 against Movalia, pursuant to Section 20(d) of the Securities Act of 1933 (“Securities Act”); Section 21(d) of the Securities Exchange Act of 1934 (“Exchange Act”); Section 209(e) of the Investment Advisers Act of 1940 (“Advisers Act”); and Section 42(e) of the Investment Company Act of 1940 (“Investment Company Act”)., This action arose from the Defendants’ efforts to fraudulently raise money for the OM Global Investment Fund LLC, an unregistered pooled investment vehicle formed in 2009, to acquire pre-IPO shares of Facebook, Inc. In its Complaint filed on September 27, 2013, the Commission alleged OMIM and Movalia falsely represented to a group of investors their interest in Facebook stock would be segregated in a special “side pocket” within the fund, when in reality, the shares were commingled with other fund investments. OMIM and Movalia also distributed false account statements to investors reflecting the purported value of their Facebook investments, even though the fund had sold all of its Facebook positions months earlier. In addition, Movalia, among other things (i) improperly used investor proceeds to make undisclosed loans to related third parties in contravention of the fund’s stated investment strategy; (ii) attempted to evade a corporate monitorship instituted in a related Florida state court private lawsuit by forming a new entity with an almost identical name to the fund and using that entity to solicit additional investments in the fund; and (iii) failed to register the fund as an investment company and also failed to register the offer and sale of investments in the fund., The Final Judgment follows a previous order by United States District Judge Jose E. Martinez in which the Court entered a Judgment of Permanent Injunction and Other Relief by consent against OMIM (i) enjoining the company from violations of Sections 5(a), 5(c), and 17(a) of the Securities Act; Section 10(b) of the Exchange Act and Exchange Act Rule 10b-5; Sections 203A, 206(1), 206(2), 206(4) and 207 of the Advisers Act and Advisers Act Rules 206(4)-2 and 206(4)-8; and from aiding and abetting violations of Section 7(a) of the Investment Company Act; (ii) imposing an asset freeze and preventing the destruction or concealment of documents; and (iii) ordering an accounting., The Court also previously entered a Judgment of Permanent Injunction and Other Relief by consent against Movalia (i) enjoining him from violations of Sections 5(a), 5(c) and 17(a) of the Securities Act; Section 10(b) of the Exchange Act and Exchange Act Rule 10b-5; Sections 206(1), 206(2), 206(4) and 207 of the Advisers Act and Advisers Act Rule 206(4)-8; and from aiding and abetting violations of Sections 203A and 206(4) of the Advisers Act and Advisers Act Rule 206(4)-2; and Section 7(a) of the Investment Company Act; (ii) imposing an asset freeze and preventing the destruction or concealment of documents; and (iii) ordering an accounting.,  , <i>http://www.sec.gov/litigation/litreleases/2014/lr23034.htm</i><br/>]"
23035,2014,"[<h3>Court Imposes Legal Services Bar Against Attorney, and Penny Stock Bars and Significant Monetary Relief Against All Defendants</h3>]","[On June 27, 2014, the U.S. District Court of Nevada issued an order imposing sanctions against an attorney, Marcus Luna, three other individuals - Nathan Montgomery, Adam Daskivich, and David Murtha - and their businesses for their roles in a multi-million dollar scheme to sell shares of Axis Technologies Group, Inc. stock in a public distribution without registration with the Commission.The Courts order:, The court also denied the SECs request for permanent injunctions for violations of the registration and fraud provisions of the federal securities laws, holding that the legal services and penny stock bars are sufficient., The court previously granted the SECs Motion for Summary Judgment on February 26, 2014, finding no genuine issues of material fact remained that the defendants each violated Section 5 of the Securities Act, and that Luna violated Sections 17(a)(1), (2), and (3) of the Securities Act, Section10(b) of the Exchange Act, and Rule 10b-5. The court then ordered the parties to further brief the issue of what remedies were appropriate given defendants violations., The Commission acknowledges the assistance of the Financial Industry Regulatory Authority., This matter was litigated on behalf of the SEC by Anne Blazek and Timothy Leiman., For further information, see <a href=/litigation/litreleases/2010/lr21779.htm>Release No. 21779</a> / December 15, 2010.,  , <i>http://www.sec.gov/litigation/litreleases/2014/lr23035.htm</i><br/>]"
