lt_no,yr,title,lt
23096,2014,"[<h3>SEC Charges China Valves Technology, Inc. and Three Senior Officers with Fraud</h3>]","[The Securities and Exchange Commission (Commission) filed a civil injunctive action today in the United States District Court for the District of Columbia charging China Valves Technology, Inc. (China Valves), its Chairman and former CEO, Siping Fang (Fang), its former CEO, Jianbao Wang (Wang), and its CFO, Renrui Tang (Tang), with misleading investors about the true nature and price of an acquisition and by mischaracterizing and materially overstating income related to its purchase and reverse engineering of a competitors product.  Based on this and related misconduct, the SEC charged China Valves and the three senior officers with violations of anti-fraud provisions of the federal securities laws; China Valves with related violations of the reporting, books and records, and internal controls provisions of the federal securities laws; and Fang, Wang, and Tang with falsely certifying that China Valvess filings contained no material misstatements and aiding and abetting China Valvess violations of the reporting and books and records provisions.  China Valves is a China-based U.S. issuer formed through a reverse merger in 2007., The case is the latest from the SECs Cross-Border Working Group that focuses on companies with substantial foreign operations that are publicly traded in the U.S.  The Commissions complaint alleges that China Valves, Fang, Wang, and Tang intentionally misled investors about China Valvess 2010 acquisition of Watts Valve Changsha Co., Ltd. (Changsha Valve) in an effort to mask the subsidiarys prior investigation of violations of the Foreign Corrupt Practices Act (FCPA) and China Valves decision to pay sales commissions to employees that potentially violated the FCPA.  Among other things, China Valves and its officers fraudulently misstated or failed to disclose certain facts about the acquisition, including:  (1) the purchase price, (2) the true seller, (3) the form of the acquisition, (4) the FCPA investigation, (5) the payment of commissions that the seller had declined to pay because of suspected FCPA violations, and (6) the role of related parties in the acquisition., The complaint further alleges that, in 2011, China Valves materially overstated income and understated liabilities incurred by a wholly-owned subsidiary, Shanghai Pudong Hanwei Valve Co., Ltd (Hanwei Valve).  Hanwei Valve purchased a valve with the plan to reverse engineer the product but, because of intellectual property concerns, intentionally disguised the payments for the valve in its books and records as Value Added Tax (VAT) payments purportedly made to the local tax authorities., The Commissions complaint alleges that China Valves, Fang, Wang, and Tang violated antifraud provisions of the securities laws in Section 10(b) of the Securities Exchange Act of 1934 (Exchange Act) and Rule 10b-5(b). The complaint further alleges that China Valves violated reporting, recordkeeping and internal controls provisions of the federal securities laws, Sections 13(a), 13(b)(2)(A), and 13(b)(2)(B) of the Exchange Act and Rules 12b-20, 13a-1, 13a-11, and 13a-13.  Finally, the complaint alleges that Fang, Wang, and Tang falsely certified that China Valvess filings contained no material misstatements in violation of Exchange Act Rule 13a-14, and aided and abetted China Valvess violations of the reporting and books and records provisions., The Commission also announced today the temporary suspension, pursuant to Section 12(k) of the Exchange Act, of trading in the securities of China Valves, at 9:30 a.m. EDT on September 29, 2014, and terminating at 11:59 p.m. EDT on October 10, 2014.  Finally, the Commission issued an order instituting administrative proceedings to determine whether the registration of China Valvess securities should be revoked for failure to make required periodic filings with the Commission., The SECs investigation, which is continuing, was conducted by Sarah Nilson, Kelly Dragelin, and Janet Yang, and supervised by Melissa Hodgman.  The litigation will be led by Alfred Day., See also:,  , <i>http://www.sec.gov/litigation/litreleases/2014/lr23096.htm</i><br/>]"
23097,2014,[<h3>SEC Files Complaint in Sham Oil Trading Company Case</h3>],"[On May 29, 2014, the Securities and Exchange Commission filed an emergency action charging Thomas Abdallah, Kenneth Grant, KGTA Petroleum Ltd. (KGTA), Mark George, Jeffrey Gainer and Jerry Cicolani with participating in a fraud involving a sham oil trading business, KGTA, that raised over $20 million from investors.  Also listed in the complaint as relief defendants were Nancy Gainer, NATG, LLC, Kelly Hood, and Turnbury Consulting Group, LLC. , The SECs complaint alleges that Grant and Abdallah marketed KGTA to investors as a petroleum company that earns profits by buying and reselling crude oil and refined fuel products. The complaint further alleges that they told investors that they had relationships with third-party purchasers and that they would use investor funds to buy fuel at a discount that would then be sold at a substantial profit.  The complaint goes on to allege that Grant and Abdallah helped convince prospective investors to invest by promising an important safeguard: the investment funds and the returns would flow through an escrow account monitored by attorney Mark George, who acted as the escrow agent.  , The SECs complaint alleges that the KGTA oil business was a sham and the escrow safeguard was a mirage. In reality, the complaint alleges, Grant and Abdallah operated KGTA as a Ponzi scheme, George never followed the promised escrow procedures, and KGTA did not generate revenue through the purchase and resale of oil products., The SECs Complaint also alleges that Grant and Abdallah sold the fraudulent investments through Jeffrey Gainer and Jerry Cicolani - two registered representatives with a Cleveland-based broker-dealer. The complaint alleges that Defendants Gainer and Cicolani committed their own violations of federal securities law including selling away and selling unregistered securities.  The complaint also alleges that Gainer and Cicolani committed fraud by recklessly selling KGTA investments despite glaring red flags that signaled that KGTA was a scam, and by hiding from investors the fact that they were being paid enormous fees by KGTA to sign up investors.  The complaint alleges that Gainer and Cicolani received over $6 million for their sales efforts.  The complaint goes on to allege that these illicit fees were funneled through NATG and Turnbury Consulting, entities owned by Gainers wife (Relief Defendant Nancy Gainer) and Cicolanis girlfriend (Relief Defendant Kelly Hood)., The Honorable Solomon Oliver, Chief Judge, United States District Court, Northern District of Ohio, issued a series of Orders granting injunctive relief, freezing assets and other emergency relief as to all of the defendants and relief defendants., The SECs investigation in this matter is continuing.,  , <i>http://www.sec.gov/litigation/litreleases/2014/lr23097.htm</i><br/>]"
23098,2014,[<h3>SEC Charges General Partner and Investment Advisers to the Stealth and Adamas Funds with Fraud</h3>],"[The Securities and Exchange Commission filed a civil injunctive action on September 25, 2014 charging Wealth Strategy Partners, LC (Wealth Strategy), a Sarasota, Florida company, and its principal, Harvey Altholtz of Sarasota, Florida, and Stevens Resource Group, LLC (Stevens Resource), a Washington company, and its principal, George Stevens of Lacey, Washington, with securities fraud involving the fraudulent offers and sales of securities in two investment funds - The Stealth Fund, LLLP and The Adamas Fund, LLLP.  Wealth Strategy and Altholtz controlled and managed the two funds and later served as investment advisers to the funds.  Stevens Resource and Stevens also served as investment advisers to both funds.   , According to the Commissions complaint filed in the United States District Court for the Middle District of Florida, the Stealth and Adamas Funds, combined, raised approximately $30.8 million from over 143 investors nationwide between 2007 and November, 2009.  The complaint alleges that, from October 2008 through April 2010, the defendants failed to disclose in offering materials distributed to investors that Stealths assets could be used to guarantee certain loans that Altholtzs family made to two portfolio companies that Stealth invested in and that his family also made loans to Adamas and Stealth in violation of the funds operating agreements.  The complaint also alleges that Wealth Strategy and Altholtz committed fraud by giving an Altholtz family trust, who was an investor in Adamas, preferential treatment with regard to redemptions over other investors.  The complaint further alleges that the defendants made misstatements and omissions in newsletters to investors regarding the financial condition of some of the funds portfolio companies. , The SECs complaint charges the defendants with violations of Section 10(b) of the Securities Exchange Act of 1934 and Rule 10b-5 thereunder, Section 17(a) of the Securities Act of 1933, and Section 206(4) of the Investment Advisers Act of 1940 and Rule 206(4)-8 thereunder.  The complaint seeks permanent injunctions, disgorgement plus prejudgment interest, and civil penalties against all of the defendants, and officer and director bars against Altholtz and Stevens.  Stevens and Stevens Resource have agreed to settle the case against them by consenting to, among other things, the entry of a judgment permanently enjoining them from future violations of the securities laws, imposing a permanent officer and director bar against Stevens, and ordering them to pay disgorgement and civil penalties, in amounts to be determined by the Court later.,  , <i>http://www.sec.gov/litigation/litreleases/2014/lr23098.htm</i><br/>]"
23099,2014,[<h3>Court Imposes Injunctions and Monetary Sanctions of Nearly $30 Million Against Former CEO and CFO of Electronic Game Card</h3>],"[The United States Securities and Exchange Commission announced that, on September 22, 2014, Judge Richard J. Sullivan of the U.S. District Court for the Southern District of New York issued an opinion and order imposing financial sanctions of more than $29.6 million on Lee Cole and Linden Boyne, the former CEO and CFO of Electronic Game Card Inc. (EGMI)., The Commissions complaint, filed in November 2012, alleged that Cole and Boyne orchestrated a fraudulent scheme in which EGMI enticed investors by claiming, among other things, that it had millions of dollars in annual revenue, millions of dollars in investments, and an off-shore bank account worth more than $10 million. In fact, many of EGMIs purported contracts were phony, the purported investments were actually in related-party entities affiliated with Cole or Boyne, and the bank account did not exist. Cole and Boyne bolstered these lies by providing falsified documents to the companys outside auditors. As a result of these and other false statements, EGMIs outstanding common stock was once valued as high as $150 million. The company subsequently filed for bankruptcy protection and its stock is now worthless. While they were making material misrepresentations to inflate EGMIs stock price, Cole and Boyne funneled millions of shares of EGMI stock to entities based in Gibraltar that they secretly controlled. They directed the Gibraltar-based entities to sell the shares, reaping proceeds of more than $12.3 million. , In August 2013 and based upon Coles and Boynes failure to comply with multiple court orders, Judge Sullivan entered default judgment against Cole and Boyne with respect to each of the Commissions 14 claims against them. Granting a motion for relief made by the Commission, Judge Sullivans recent order holds Cole and Boyne jointly and severally liable for disgorgement of $12,345,908.74 plus $2,324,842.25 in prejudgment interest and requires each to pay a civil penalty of $7,500,000.00. Judge Sullivans order also permanently enjoins Cole and Boyne from violating the securities laws, serving as officers or directors of any public company, and participating in any activities involving the offer of penny stocks.  , In addition to Cole and Boyne, the Commission action named as defendants former EGMI CEO Kevin Donovan and the companys former outside auditor Timothy Quintanilla. In September 2013 and pursuant to a settlement agreement between Donovan and the Commission, Judge Sullivan issued a final judgment as to Donovan that permanently bars him from participating in an offering of penny stock, bars him from serving as an officer or director of certain companies for five years, and permanently enjoins him from violating Sections 17(a)(1) and 17(a)(3) of the Securities Act of 1933 and Section 10(b) of the Securities Exchange Act of 1934 and Rule 10b-5 thereunder. The action against Quintanilla is pending., For further information see Litigation Release 22529 (November 9, 2102).,  , <i>http://www.sec.gov/litigation/litreleases/2014/lr23099.htm</i><br/>]"
23100,2014,[<h3>SEC Charges Pennsylvania-Based Registered Representative with Stealing Funds from Customers</h3>],"[On September 30, 2014, the Securities and Exchange Commission charged Dennis F. Wright, a former registered representative based in Lewistown, Pennsylvania, with defrauding his customers by stealing their funds for his personal use and falsifying their account statements to cover up his fraud., According to the SECs complaint filed in U.S. District Court for the Middle District of Pennsylvania, Wright misappropriated more than $1.5 million from at least 28 customers.  Wright fraudulently induced his customers to redeem securities held in their securities accounts, including variable annuities and mutual funds, by falsely representing that he would invest the proceeds from the redemptions in a managed account that held other securities that yielded higher returns than their existing securities accounts.  Instead, Wright deposited his customers funds in a bank account he controlled and from which he misappropriated the funds in order to pay his personal expenses as well as to fund customer withdrawals.  Wright concealed his fraud by providing his customers with falsified account statements purportedly showing that they had purchased and owned interests in the non-existent managed accounts with appreciating balances., In a parallel action, the U.S. Attorneys Office for the Middle District of Pennsylvania announced criminal charges against Wright., Wright has agreed to settle the SECs charges and disgorge his ill-gotten gains, which will be deemed satisfied by the entry of an order of restitution in the criminal case.  He also consented to the entry of an order permanently enjoining him from violating Section 17(a) of the Securities Act of 1933 and Section 10(b) of the Securities Exchange Act of 1934 and Rule 10b-5 thereunder.  The settlement is subject to court approval., As part of the settlement, and following the entry of the proposed final judgment, Wright has consented to the entry of a Commission order, pursuant to Exchange Act Section 15(b)(6) and Section 203(f) of the Investment Advisers Act of 1940, permanently barring him from association with any broker, dealer, investment adviser, municipal securities dealer, municipal advisor, transfer agent, or nationally recognized statistical rating organization; and barring him from participating in any offering of a penny stock., The SECs investigation was conducted by Kingdon Kase, Paulina L. Jerez, and Dustin Ruta of the Philadelphia Regional Office.  The SEC appreciates the assistance of the U.S. Attorneys Office for the Middle District of Pennsylvania and the Federal Bureau of Investigation in this matter.,  , <i>http://www.sec.gov/litigation/litreleases/2014/lr23100.htm</i><br/>]"
23101,2014,"[<h3>The Securities and Exchange Commission (Commission) Announced That On September 24, 2014, George B. Franz III (Franz) Was Sentenced for His Obstruction of an SEC Investigation and Making False Statements to SEC Staff.</h3>]","[The Securities and Exchange Commission (Commission) announced that on September 24, 2014, George B. Franz III (Franz) was sentenced for his obstruction of an SEC investigation and making false statements to SEC staff. Previously, on June 3, 2014, Franz pleaded guilty to one count of obstruction of an official proceeding (18 U.S.C. Â§ 1512(c)(2)), one count of destruction or falsification of records in a federal investigation (18 U.S.C. Â§ 1519), and two counts of providing false statements and documents to an agency of the executive branch (18 U.S.C. Â§ 1001). , These criminal acts took place during the SECs investigation of Franz and Ruby Corporation, which culminated in an Administrative Proceeding instituted in September 2013. (In the Matter of George B. Franz III and Ruby Corporation, AP No. 3-15526 https://www.sec.gov/litigation/apdocuments/ap-3-15526.xml). In that action, the Division of Enforcement alleged that Franz and Ruby, among other things, lied to Ruby Corporation clients as to thefts by Andrew Franz (Franzs son) from client accounts. Franz and Ruby later consented to a settlement of this proceeding in which they paid a $675,000 civil penalty and $425,000 in disgorgement including prejudgment interest. https://www.sec.gov/litigation/admin/2014/34-72058.pdf The SEC then distributed $364,231 of this total to Ruby clients who had been victims of thefts by Andrew Franz., On September 24, 2014, the Honorable Christopher A. Boyko sentenced Franz to three years of probation and a $25,000 fine for his criminal conduct in obstructing the SECs investigation.  As a special condition to Franzs supervision, the Court also ordered that Franz make a $250,000 payment to the SEC to compensate the SEC for the diversion of investigative resources caused by Franzs obstructive conduct. The SEC thanks the U.S. Attorneys Office for the Northern District of Ohio for its efforts in bringing this criminal action.,  , <i>http://www.sec.gov/litigation/litreleases/2014/lr23101.htm</i><br/>]"
23102,2014,[<h3>Former Cleveland-Area Investment Promoter Oscar F. Villarreal Indicted</h3>],"[On September 16, 2014, the United States Attorney for the Northern District of Ohio obtained a Grand Jury indictment charging Oscar F. Villarreal with ten counts of wire fraud, seven counts of money laundering, one count of securities fraud, and one count of investment adviser fraud.  , The Indictments allegations are based on the same conduct underlying the Commissions August 26, 2014 Complaint against Villarreal filed in the United States District Court for the Northern District of Ohio.  , The SECs Complaint alleges that from March 2009 through December 2010, Villarreal conducted a fraudulent offering, known as Fund III, which raised $9.2 million from 46 investors.  According to the complaint, Villarreal told investors that their money was to be used to make private equity investments in companies in the petroleum, steel, and other industries in Mexico.  Villarreal lied to these investors about the success of a previous fund he operated, lied in saying that he used their money to purchase and profitably operate a Mexican pipeline manufacturer, and lied by telling investors that Fund III had ownership interests in several U.S. and Mexican drilling companies.  Villarreal instead used $7.4 million of Fund III assets to trade in publicly traded securities in a brokerage account-contrary to his representations to investors-and sustained heavy losses, and also stole $5.8 million for himself.  By November 2011, Fund III was essentially insolvent., The Commissions complaint also alleges that, between August 2010 and March 2011, Villarreal conducted a second fraudulent offering, known as the Standard Asset Management Fund I, (SAM Fund), which raised $9 million from 11 investors, six of whom had previously invested in Fund III.  According to the complaint, Villarreal told these investors that the SAM Fund would invest in companies listed on the Mexican stock exchange.  Villarreal made numerous misrepresentations to these investors.  Among other things, Villarreal repeated his earlier lies about Fund II and Fund IIIs purported acquisition and profitable operation of a Mexican pipeline manufacturer,  he stole at least $327,000 of SAM Fund assets, and Villarreals trading was a massive failure, resulting in an 83% loss for the SAM Fund., The complaint also alleges that Villarreal defrauded the SAM Fund investors between March 2012 and May 2012 by offering to exchange limited partnership units he claimed he owned in Fund III for the SAM Fund investors limited partnership units in the SAM Fund.  Eight SAM Fund investors accepted Villarreals offer and exchanged their SAM Fund units, which they had purchased for a total of $3.1 million.  Villarreal, however, lied about the number of Fund III limited partnership units he owned and the value of the Fund III units.  Villarreal did not disclose to these investors that the Fund III limited partnership units were worthless.  , The SECs Complaint alleges that Villarreal violated Section 17(a) of the Securities Act of 1933, Section 10(b) of the Securities Exchange Act of 1934 and Rule 10b-5 thereunder, Sections 206(1), 206(2), and 206(4) of the Investment Advisers Act of 1940 and Rule 206(4)-8 thereunder.  The Commissions complaint seeks a permanent injunction, disgorgement of ill-gotten gains plus prejudgment interest, and civil penalties., For further information, please see Litigation Release Number 23073 (August 26, 2014).,  , <i>http://www.sec.gov/litigation/litreleases/2014/lr23102.htm</i><br/>]"
23104,2014,[<h3 class=bold>What should you do?</h3>],"[<p class=options><a href=/edgar/searchedgar/companysearch.html tabindex=6>Company Filings</a> | <a href=/search/search.htm tabindex=7>More Search Options</a>, Were sorry, but the page youre looking for might have been removed, had its name changed, or is temporarily unavailable., To report a broken link, please email <a href=mailto:webmaster@sec.gov?subject=Broken link:%20>webmaster@sec.gov</a>.                                        <br/>We regret any inconvenience, and we thank you for your interest in the SEC website. , <p class=italic text-right row id=ssi-modified>Modified: Sept. 11, 2015, <p class=title data-section-title=><a href=/index.htm>U.S. Securities and Exchange Commission</a>, <p class=title data-section-title=><a href=/News/Page/Landing/Page/1356125649504>Newsroom</a>, <p class=title data-section-title=><a href=#> RSS Feeds</a>, <p class=title data-section-title=><a href=#> Social Media</a>, <p class=options><a href=/edgar/searchedgar/companysearch.html>Company Filings</a> | <a href=/search/search.htm>More Search Options</a>]"
23105,2014,"[<h3>SEC Files Subpoena Enforcement Action Against John Puglisi, Progressive Capital Solutions LLC, and Others</h3>]","[The Securities and Exchange Commission announced today that, on September 30, 2014, it filed a subpoena enforcement action in the U.S. District Court for the Eastern District of Pennsylvania against John Puglisi, Progressive Capital Solutions LLC, and others.  Puglisi and Progressive are defendants in a state court litigation brought by CMS Life Insurance Opportunity Fund, L.P. (which is also a respondent in the subpoena enforcement action) and CNF II Partners, in which it is alleged that Puglisi and Progressive-instead of safeguarding certain investments they were retained to make-had been stealing the investments and selling them for their own benefit.  As set forth in the Commissions Application, the staff of the Commissions Philadelphia Regional Office is investigating whether there were misstatements and omissions related to the use of investor funds and the profitability, safety, value, and existence of assets purportedly owned by CMS Life Insurance Opportunity Fund and others., Among other things, the subpoena enforcement action was filed because, despite the issuance of administrative subpoenas duces tecum to Puglisi and Progressive, they have not produced any documents and, thus, have not complied with the subpoenas.  Pursuant to its Application, the Commission is seeking an order from the federal district court compelling compliance with various subpoenas and for other relief.  The Commission notes that it is continuing to conduct a fact-finding inquiry and has not concluded that anyone has broken the law.,  , <i>http://www.sec.gov/litigation/litreleases/2014/lr23105.htm</i><br/>]"
