lt_no,yr,title,lt
22969,2014,"[<h3>SEC, Criminal Authorities Halt Florida Ponzi Scheme Targeting Investors in Virtual Concierge Machines</h3>]","[On April 7, 2014, the Securities and Exchange Commission filed an emergency action to halt a Ponzi scheme conducted by JCS Enterprises, Inc., T.B.T.I. Inc., and their respective principals Joseph Signore of West Palm Beach, Fla. and Paul L. Schumack II of Pompano Beach, Fla.  The complaint, filed in United States District Court for the Southern District of Florida, alleges that, from at least 2011 through the present, the defendants fraudulently raised at least $40 million from hundreds of investors nationwide through the ongoing sale of investments in Virtual Concierge machines (VCMs).  The defendants guaranteed exorbitant returns, ranging from 80 to 120% annually and up to 500% over the life of a three- or four-year investment contract.  Also, on April 7, 2014, Judge Donald M. Middlebrooks, U.S. District Judge for the Southern District of Florida, issued an order placing JCS and TBTI under the control of a receiver to safeguard assets, as well as other emergency orders, including temporary restraining orders and asset freezes. , According to the SEC’s complaint unsealed today, JCS, T.B.T.I, Signore, and Schumack touted the VCMs as a revolutionary product and fail-safe investment.  The defendants promised to place and manage VCMs, which are ATM-like machines, at various locations to advertise products and services via touch screen, and print tickets or coupons, among other services.  They represented that advertising revenue would generate the guaranteed returns paid to investors, who did not have to take any additional steps to earn their money.  In reality, Signore, Schumack and their companies operated a Ponzi scheme, where, through numerous misrepresentations and omissions, they used new investor funds to make payments to earlier investors.  , In a parallel action, the U.S. Attorney’s Office for the Southern District of Florida today announced criminal charges against Signore and Schumack. , The defendants promoted VCMs on the internet though YouTube videos, and promised to locate, place and manage the VCMs, as well as inform investors about the location and activity of their VCMs.  These representations were false.  The defendants did not place VCMs at anywhere near the rate of those purchased by investors.  Moreover, investors could not track their VCM’s activity, and the defendants did not provide investors with the location of their VCMs as promised. , The SEC’s complaint alleges that while operating the Ponzi scheme, Signore and Schumack also diverted more than $2.5 million to themselves and family members, and used money to fund other business ventures, for recreational purposes, and to satisfy financial obligations.  While the majority of investors stopped receiving their monthly payments in January 2014, the defendants continued to solicit investors.  Schumack continued lying to investors in an effort to generate more capital by providing a bulletin stating their last opportunity to invest was expiring at year end 2013.  Schumack later fabricated excuses to placate irate investors who were no longer receiving their returns, telling them their checks were forthcoming.  They were not.  When investors started complaining, JCS also continued its fraud by issuing a press release, posted on its website, claiming it was “investigating the matter” and TBTI had defrauded JCS.   , The SEC’s complaint charges JCS, TBTI, Signore and Schumack with violating Sections 5(a), 5(c) and 17(a) of the Securities Act of 1933 and Section 10(b) of the Securities Exchange Act of 1934 and Rule 10b-5 thereunder.  The SEC also seeks disgorgement of all ill-gotten gains, including prejudgment interest thereon; an order directing the defendants to pay civil money penalties; and any other relief that may be necessary and appropriate., The SEC’s investigation was conducted by Fernando Torres, Linda S. Schmidt, Vincent T. Hull and Mark Dee in the Miami Regional Office, and supervised by Jason R. Berkowitz.  The SEC’s litigation is being led by Russell Koonin and Vincent T. Hull.  The SEC appreciates the assistance of the U.S. Attorney’s Office for the Southern District of Florida, the Federal Bureau of Investigation, the Florida Office of Financial Regulation and the Texas State Securities Board.  The SEC’s investigation is continuing.  ,  , <i>http://www.sec.gov/litigation/litreleases/2014/lr22969.htm</i><br/>]"
22970,2014,"[<h3>SEC Charges Carters, Inc.s Former Vice-President of Operations with Insider Trading and Tipping</h3>]","[On March 6, the Securities and Exchange Commission filed a civil injunctive action in federal court in the Northern District of Georgia against Richard T. Posey (Posey), the former Vice-President of Carters, Inc. (Carters or the company), an Atlanta based public issuer and clothing marketer.   The Commission alleges that Posey repeatedly traded in the securities of Carters based on inside information that he possessed as a result of his position at Carters, and that he tipped material nonpublic information to the companys former Vice-President and Director of Investor Relations, Eric M. Martin (Martin).,  The Commissions complaint alleges that from at least January 2006 through at least October 2009, while in possession of material inside information, Posey traded Carters stock without preclearance during blackout periods in advance of quarterly earnings releases and announcements. Poseys trades produced gains and avoided losses totaling $49,778. The complaint also alleges that between April 2009 and at least October 2010, Posey repeatedly tipped Carters inside information to Martin, who in turn tipped others.   In October 2009, two of Martins tippees avoided losses of more than $3 million based on one of Poseys tips., The Commissions complaint alleges that Posey violated the antifraud provisions of the federal securities laws, Section 17(a) of the Securities Act of 1933, Section 10(b) of the Securities Exchange Act of 1934 and Rule 10b-5 thereunder, and seeks a permanent injunction, an officer and director bar, disgorgement with prejudgment interest, and civil monetary penalties pursuant to Section 21A of the Exchange Act., Posey consented to the entry of an order enjoining him from future violations of the antifraud provisions, ordering him to pay disgorgement and prejudgment interest totaling $60,265, and permanently barring him from serving as an officer and director of a public company.  The amount of a civil penalty is to be determined at a future date by the Court upon motion of the Commission., On June 19, 2013, in response to a criminal information filed by the U.S. Attorneys Office for the Northern District of Georgia, Posey pled guilty to one count of conspiracy to commit securities fraud in connection with the illicit conduct described in the Commissions complaint., This is the fourth case that the Commission has brought alleging insider trading in connection with its ongoing investigation of trading in the securities of Carters and the Commissions seventh overall case as part of its broader investigation of financial fraud., <b>SEC Litigation Releases Related to Insider Trading Cases:</b>, <b>SEC Litigation Releases Related to Financial Fraud Cases:</b>, The Commission appreciates the assistance of the U.S. Attorneys Office for the Northern District of Georgia and the Financial Industry Regulatory Authority.  The Commissions investigation is continuing.,  , <i>http://www.sec.gov/litigation/litreleases/2014/lr22970.htm</i><br/>]"
22971,2014,[<h3>SEC Obtains Final Judgment Against Defendant in Fictitious Investment Scheme</h3>],"[The Securities and Exchange Commission announced today that on April 4, 2014, a Massachusetts federal court entered a final judgment by consent against defendant Robert C. Rice, of Tallahassee, Florida, in a securities fraud case filed by the Commission in 2011.  The final judgment, entered by the Honorable Mark L. Wolf, imposes on Rice a permanent injunction against future violations of antifraud and other provisions of the federal securities laws and orders him to pay disgorgement, prejudgment interest and a civil penalty totaling $525,896.51., In its Complaint, filed September 19, 2011, the Commission alleged that beginning in 2007, Rice, with other defendants, purported to offer direct investments in fraudulent trading programs involving bank guarantees, promising sky-high returns with guarantees against loss.  In fact, the Commission alleges that the bank guarantees were fictional and the trading programs non-existent, and that Rice and other defendants together defrauded investors of more than $1.8 million.  The final judgment permanently enjoins Rice from violating Section 17(a) of the Securities Act of 1933; Section 10(b) of the Securities Exchange Act of 1934 and Rule 10b-5 thereunder; Sections 5(a) and 5(c) of the Securities Act; and Section 15(a) of the Exchange Act.  The final judgment also ordered that Rice is liable for disgorgement in the amount of $310,500, representing profits gained as a result of the conduct alleged in the Complaint, with prejudgment interest of $85,396.51, and imposed a civil penalty in the amount of $130,000.  Rice consented to the entry of the final judgment without admitting or denying the allegations in the Commissions Complaint., On March 13, 2013, the court entered final judgments by default against defendants 211 Ventures, LLC, and Robert S. Anderson, imposing judgments totaling more than $2.3 million in disgorgement, prejudgment interest and civil penalties, and permanently enjoining both defendants from future violations of the antifraud and other provisions of the federal securities laws.  The Commissions case against defendants Diane Glatfelter and K2 Unlimited, Inc. continues., The Commissions Complaint alleges that the defendants in this matter purported to offer investment using so-called bank guarantees among other fictional instruments.  Investors who are offered investments similar to those alleged in the Commissions complaint may want to consult the SECs website concerning How Prime Bank Frauds Work, at: <a href=http://www.sec.gov/divisions/enforce/primebank/howtheywork.shtml>http://www.sec.gov/divisions/enforce/primebank/howtheywork.shtml.</a>, For further information, see Litigation Release No. <a href=/litigation/litreleases/2013/lr22649.htm>22649</a> (March 19, 2013), and Litigation Release No. <a href=/litigation/litreleases/2011/lr22098.htm>22098</a> (September 19, 2011).,  , <i>http://www.sec.gov/litigation/litreleases/2014/lr22971.htm</i><br/>]"
22972,2014,[<h3>SEC Charges Indiana Man for Defrauding Investors in Credit Union Ponzi Scheme</h3>],"[On April 11, 2014, the Securities and Exchange Commission filed an action charging Indianapolis-based Timothy J. Coughlin, 63, and two entities that did business as Oxford International Credit Union or Oxford International Cooperative Union with conducting an Internet offering fraud in which investors lost millions of dollars by investing funds in a fictitious credit union.  The complaint alleges that between June 2007 and December 2009, Coughlin and Oxford International Credit Union collected deposits from more than 5,000 investors exceeding $12.8 million dollars.  Approximately 3,300 of the investors were U.S. residents, with victims residing in all 50 states and the District of Columbia.  The SECs complaint alleges that Coughlin misappropriated investor money to pay personal expenses, fund unrelated business expenses, and make distributions to other investors in a classic Ponzi-scheme fashion., According to the SECs complaint, to further the fraud, the defendants posted false information to investors online accounts to create the appearance that their deposits in the fake credit union were earning substantial daily investment returns.  The Oxford International Credit Union website (www.oxfordicu.com), for example, showed investors that their deposits were purportedly earning investment returns that averaged, during the January 2007 through December 2009 period, 0.471% each trading day, equating to an approximately 356% average annual rate of return.  According to the complaint, however, the defendants did not actually make investments with the members deposits sufficient to generate the returns they boasted.  Coughlin and Oxford International Credit Union also falsely claimed that member accounts were insured by a private insurance company.  Then, beginning in December 2008, Coughlin began operating a successor to Oxford International Credit Union, called Oxford International Cooperative Union, which also boasted bogus investment returns on its website (<a href=/cgi-bin/goodbye.cgi?www.oxfordprivacygroup.com/>www.oxfordprivacygroup.com</a>) from its inception in late 2008 through December 2011. , The SECs complaint alleges that Coughlin misappropriated at least $5.97 million and used investor money for illegitimate purposes, including $1.57 million used for personal expenditures and $4.4 million (or approximately 35%) to pay other investors who had requested withdrawals from their Oxford International Credit Union accounts .  Coughlin also transferred money from Oxford International Credit Unions accounts to bank accounts he controlled in the names of two relief defendants., According to the SECs complaint, in late 2008 and 2009, Coughlin began to deny investors requests for withdrawals from their accounts.  To explain his refusal to allow investors to access their funds, Coughlin falsely claimed that Internal Revenue Service and foreign tax authorities had frozen Oxford International Credit Union and Oxford International Cooperative Unions accounts., In a parallel action, the U.S. Attorneys Office for the Eastern District of Virginia today unsealed a criminal complaint against Coughlin., The SECs complaint charges Coughlin, OICU Ltd. and OICU Investments Corp. with violating Sections 5(a), 5(c), and 17(a) of the Securities Act of 1933 and Section 10(b) of the Securities Exchange Act of 1934 and Rule 10b-5 thereunder and seeks disgorgement of all ill-gotten gains with prejudgment interest, civil penalties, conduct-based injunctions, and an officer-and-director bar against Coughlin. The SEC also seeks disgorgement and prejudgment interest from relief defendants American Quality Cleaning Services, Inc. (d/b/a Oxford Privacy Group) and Avocalon LLC., The SECs investigation was conducted by Adam J. Eisner and Carolyn E. Kurr in the Washington, D.C. office, and supervised by C. Joshua Felker.  The SECs litigation is being led by Stephan J. Schlegelmilch and Bridget M. Fitzpatrick., The SEC appreciates the assistance of the U.S. Attorneys Office for the Eastern District of Virginia; the Federal Bureau of Investigation; the Department of the Treasury, Treasury Inspector General for Tax Administration; the Indiana Secretary of State, Securities Division; the National Credit Union Administration; and the Ontario Securities Commission., The SECs investigation is continuing., <img alt= border=0 height=9 src=/images/arrowright_dkblue.gif width=10/><a href=/litigation/complaints/2014/comp22972.pdf>SEC Complaint</a>,  , <i>http://www.sec.gov/litigation/litreleases/2014/lr22972.htm</i><br/>]"
22973,2014,[<h3>Federal Prosecutors Charge Massachusetts Resident with Criminal Contempt Based On Violations of Court Orders Obtained by the SEC</h3>],"[The Securities and Exchange Commission announced today that, on April 10, 2014, the United States Attorneys Office for the District of Massachusetts charged Steven Palladino with 25 counts of criminal contempt based on his repeated violations of Court orders obtained by the Commission in its civil action against Palladino and his Massachusetts-based company, Viking Financial Group, Inc. (collectively, Defendants).  The Commissions action charged that Defendants were operating a fraudulent Ponzi scheme.  The charging document filed by the United States Attorneys Office alleges that Palladino knowingly and wilfully disobey[ed] Court orders in the Commissions action that froze all of Defendants assets, required that Defendants deposit all funds in their possession into a court-ordered escrow account, and required Palladino to purge himself of a prior order of civil contempt.  If convicted, Palladino, who is currently serving a prison sentence based on convictions in state court for the same Ponzi scheme activity, could face additional incarceration., On April 30, 2013, the Commission filed an emergency action against Defendants in federal district court in Massachusetts.  In its complaint, the Commission alleged that, since April 2011, Defendants misrepresented to at least 33 investors that their funds would be used to conduct the business of Viking - which was purportedly to make short-term, high interest loans to those unable to obtain traditional financing.  The Commission also alleged that Palladino misrepresented to investors that the loans made by Viking would be secured by first interest liens on non-primary residence properties and that investors would be repaid their principal, plus monthly interest at rates generally ranging from 7-15%, from payments that borrowers made on the loans.  The complaint alleged that Defendants actually made very few real loans to borrowers, and instead used investors funds largely to pay earlier investors and to fund the Palladino familys lavish lifestyle., When the Commission first filed its action, it moved the Court for a temporary restraining order, asset freeze, and other emergency relief.  On April 30, 2013, the Court issued a temporary restraining order, which included the asset freeze, and set the matter for further hearing on May 3, 2013.  On May 3, 2013, the Court issued a revised restraining order, which included the same asset freeze.  On May 15, 2013, the Court issued the order that Defendants deposit all funds in their possession into an escrow account.  The asset freeze and escrow order have remained in effect at all times since April 30, 2013 and May 15, 2013, respectively., Since September 2013, the Commission has filed four motions for civil contempt against Palladino.  The Commissions first motion for contempt, filed on September 4, 2013, alleged that Palladino violated the asset freeze by transferring three vehicles that he owned (solely or jointly with his wife) into his wifes name and using the vehicles as collateral for new loans - effectively cashing out the equity in these vehicles.  The motion also alleged that Palladino violated the escrow order by failing to deposit the funds he received from this cashing-out process into the escrow account.  On November 15, 2013, the Court held Palladino in contempt and ordered that he restore ownership of the vehicles that he had transferred into his wifes name.  Subsequently, Palladino reported to the Court that he had repaid all the new loans and restored ownership of two of the vehicles (but had failed to restore ownership of one vehicle).  The Commission alleges that, in truth, the checks used to repay the new loans on the vehicles were all returned for insufficient funds.  According to the Commissions allegations, to date, Palladino has not purged the civil contempt order against him.  The Commission also filed three other contempt motions against Palladino charging that (i) he obtained a loan for $6,750 from a Viking investor and failed to deposit this amount into the escrow account; (ii) he sold a truck owned by him for $9,500 and failed to deposit this amount into the escrow account; and (iii) he opened new credit cards and ran up charges for cash advances, gold coins, luxury merchandise and fine dining and failed to deposit the cash and other assets obtained into the escrow account - all in violation of the asset freeze and escrow order.  These three motions remain outstanding.  The United States Attorneys Offices criminal charges arise from these same violations, as well as Palladinos alleged refusal to comply with the civil contempt order., On July 15, 2013, the Court held that Defendants conduct violated Section 10(b) of the Exchange Act and Rule 10b-5 thereunder and Section 17(a) of the Securities Act.  On November 18, 2013, the Court entered orders that enjoined Defendants from further violations of the antifraud provisions of the securities laws and ordered them to pay disgorgement of $9,701,738, plus prejudgment interest of $122,370.  On January 14, 2014, Palladino pled guilty in Suffolk Superior Court to various state criminal charges based on the same conduct alleged by the Commission in its case.  Palladino is currently serving a 10-12 year prison sentence for his state court convictions., The Commission acknowledges the continued assistance of Suffolk County (Massachusetts) District Attorney Daniel F. Conleys Office, whose office referred Palladinos and Vikings conduct to the Commission.,  , <i>http://www.sec.gov/litigation/litreleases/2014/lr22973.htm</i><br/>]"
22974,2014,[<h3>SEC Halts Pyramid Scheme Targeting Dominican and Brazilian Immigrants</h3>],"[The Securities and Exchange Commission today announced that on Tuesday, April 15, 2014, it filed charges against the Massachusetts-based operators of a large pyramid scheme that mainly targeted Dominican and Brazilian immigrants in the U.S.   The charges were filed under seal, in connection with the Commissions request for an immediate asset freeze.  That asset freeze, which the U.S. District Court in Boston ordered on Wednesday, secured millions of dollars of funds and prevented the potential dissipation of investor assets.  After the SEC staff implemented the asset freeze, at the SECs request the Court lifted the seal today, permitting public announcement of the SECs charges.,  The SEC alleges that TelexFree, Inc. and TelexFree, LLC claim to run a multilevel marketing company that sells telephone service based on voice over Internet (VoIP) technology but actually are operating an elaborate pyramid scheme.  In addition to charging the company, the SEC charged several TelexFree officers and promoters, and named several entities related to TelexFree as relief defendants based on their receipt of investor funds.,  According to the SECs complaint filed in federal court in Massachusetts, the defendants sold securities in the form of TelexFree memberships that promised annual returns of 200 percent or more for those who promoted TelexFree by recruiting new members and placing TelexFree advertisements on free Internet ad sites.  The SEC complaint alleges that TelexFrees VoIP sales revenues of approximately $1.3 million from August 2012 through March 2014 are barely one percent of the more than $1.1 billion needed to cover its promised payments to its promoters.  As a result, in classic pyramid scheme fashion, TelexFree is paying earlier investors, not with revenue from selling its VoIP product but with money received from newer investors.,  According to the SECs complaint, the defendants have continued enrolling new investors but recently changed TelexFrees method of compensating promoters, requiring them to actually sell the VoIP product to qualify for payments that TelexFree had previously promised to pay them.  The complaint also alleges that since December 2013, TelexFree has transferred $30 million or more of investor funds from TelexFree operating accounts to accounts controlled by TelexFree affiliates or the individual defendants., In addition to the TelexFree firms, the complaint charges TelexFree co-owner James Merrill, of Ashland, Mass., TelexFree co-owner and treasurer Carlos Wanzeler, of Northborough, Mass., TelexFree CFO Joseph H. Craft, of Boonville, Ind., and TelexFrees international sales director, Steve Labriola, of Northbridge, Mass.  The SEC also charged four individuals who were promoters of TelexFrees program:  Sanderley Rodrigues de Vasconcelos, formerly of Revere, Mass., now of Davenport, Fla., Santiago De La Rosa, of Lynn, Mass., Randy N. Crosby, of Alpharetta, Ga., and Faith R. Sloan, of Chicago., The SECs complaint alleges that TelexFree, Inc., TelexFree, LLC, Merrill, Wanzeler, Craft, Labriola, Rodrigues de Vasconcelos, De La Rosa, Crosby, and Sloan violated the registration and antifraud provisions of U.S. securities laws: Sections 5(a), 5(c), and 17(a) of the Securities Act of 1933, and Section 10(b) of the Securities Exchange Act of 1934 and Rule 10b-5 thereunder. Among other things, the SECs complaint seeks, against these primary defendants, permanent injunctions prohibiting further violations of the laws charged, disgorgement of ill-gotten gains plus prejudgment interest, and civil monetary penalties.  The SEC also charged three entities related to TelexFree (TelexFree Financial, Inc., TelexElectric, LLLP, and Telex Mobile Holdings, Inc.) as relief defendants based on their receipt of investor funds, and seeks disgorgement of those funds plus prejudgment interest., <img alt= border=0 height=9 src=/images/arrowright_dkblue.gif width=10/><a href=/litigation/complaints/2014/comp-pr2014-79.pdf>SEC Complaint</a>,  , <i>http://www.sec.gov/litigation/litreleases/2014/lr22974.htm</i><br/>]"
