lt_no,yr,title,lt
23946,2017,Court Enters Final Judgment Against Operator of Fake Day-Trading Firm,"[The Securities and Exchange Commission has obtained a final judgment against one of the operators of a phony day-trading firm whom <a href=https://www.sec.gov/litigation/litreleases/2017/lr23830.htm>the agency charged</a> with pocketing more than $1.4 million in deposits from hundreds of defrauded investors worldwide., The final judgment, entered on September 18, 2017 by the Honorable Kevin McNulty of the U.S. District Court for the District of New Jersey, permanently enjoins Naris Chamroonrat, of Bangkok, Thailand, from violating Section 17(a) of the Securities Act of 1933 and Sections 10(b), 15(a)(1) and 20(b) of the Securities Exchange Act of 1934 and Rule 10b-5 thereunder and orders him liable for disgorgement of $918,147.31, plus interest of $71,549.24, the payment of which is deemed satisfied by the restitution ordered in the parallel criminal case.  Chamroonrat, who pled guilty in a parallel criminal case, is awaiting sentencing., The SECs amended complaint alleges that Chamroonrat and others lured investors to day-trade through Nonko Trading, an unregistered brokerage firm, with promises of generous leverage, low trading commissions, and low minimum deposit requirements when, in fact, investor money was instead used to fund defendants personal expenses, pay associates, and make Ponzi-like payments to investors who asked to close their accounts.  The SEC encourages investors to check the backgrounds of people selling investments by using the <a href=http://www.investor.gov/> SECs investor.gov website</a> to quickly identify whether they are registered professionals and confirm their identity., The SECs continuing investigation is being conducted by Simona Suh, Barry OConnell, and John Marino of the SECs Market Abuse Unit and by Elzbieta Wraga of the New York Regional Office.  The case has been supervised by Joseph G. Sansone, Chief of the Market Abuse Unit.  The SECs litigation is led by Ms. Suh and Mr. OConnell.  The SEC appreciates the assistance of the U.S. Attorneys Office for the District of New Jersey, Federal Bureau of Investigation, Financial Industry Regulatory Authority, Australian Securities and Investments Commission, Securities Commission of The Bahamas, Financial Supervisory Commission of the Cook Islands, Israel Securities Authority, Financial Services Commissions Nevis Branch, Ontario Securities Commission, Monetary Authority of Singapore, and Securities and Exchange Commission of Thailand.,  , <i>https://www.sec.gov/litigation/litreleases/2017/lr23946.htm</i><br/>]"
23947,2017,SEC Charges Unregistered Broker-Dealers and Penny Stock Company With Registration Violations For Illegal Stock Sales,"[The Securities and Exchange Commission has charged six unregistered broker-dealers located in California and Colorado with illegally selling securities in penny stock companies., The SECs complaint alleges that brothers David H. Welch and Marc J. Bryant, both located in southern California, and John C. Knight, located in Colorado, sold securities in New Global Energy Inc., its predecessor company, Global Energy Technology Group, Inc., and other companies in unregistered transactions using sales agents located in boiler rooms, both nationally and internationally, raising over $10 million from investors over four years.  Welch, Bryant and Knight used various entities, including Defendants Bio-Global Resources, Inc., Diversified Equities Inc. (DEI), and Diversified Equities Development Inc. (DED), to make these illegal sales.  In addition, according to the complaint, all of the defendants, including New Global and its CEO, Florida attorney Perry D. West, sold securities without filing a registration statement with the SEC., The SEC alleges that Welch, Bryant, Knight, Bio-Global, DEI and DED werent registered with the SEC to sell investments.  The SEC encourages investors to check the backgrounds of people selling investments by using the <a href=http://www.investor.gov/>SECs investor.gov website</a> to quickly identify whether they are registered professionals and confirm their identity., The complaint alleges that Welch, Bryant, Knight, Bio-Global, DEI and DED violated Section 15(a)(1) of the Securities Exchange Act of 1934, and all the defendants violated Sections 5(a) and (c) of the Securities Act of 1933.  The complaint seeks injunctions, disgorgement of the defendants ill-gotten gains, prejudgment interest, penalties, and penny stock bars., Knight and DEI, without admitting or denying the allegations in the SECs complaint, agreed to entry of a judgment that enjoins them from violating the charged provisions of the federal securities laws and imposes a penny stock bar against Knight.  There will be further proceedings before the court to determine the amounts of disgorgement, interest, and civil penalties.  Knight also consented, without admitting or denying the findings, to an SEC Order barring him from the securities industry., The SECs investigation was conducted by Jacqueline M. Moessner and supervised by Mary S. Brady.  The SECs litigation is being led by Leslie J. Hughes., <img alt= border=0 height=9 src=/images/arrowright_dkblue.gif width=10/><a href=/litigation/complaints/2017/comp23947.pdf>SEC Complaint</a>,  , <i>https://www.sec.gov/litigation/litreleases/2017/lr23947.htm</i><br/>]"
23948,2017,SEC Obtains Final Judgment Against Former CFO in $1.1 Million Insider Trading Scheme,"[The Securities and Exchange Commission has obtained a final judgment against the former chief financial officer of a technology company and certified public accountant, who <a href=https://www.sec.gov/news/pressrelease/2015-90.html>was charged</a>, along with his son, with conducting a serial insider trading scheme involving tips of key nonpublic information in coded e-mail messages disguised as discussions about golf., The final judgment, entered on September 27, 2017 by the Honorable Analisa Torres of the U.S. District Court for the Southern District of New York, permanently enjoins Robert K. Stewart from violating Sections 10(b) and 14(e) of the Securities Exchange Act of 1934 and Rule 10b-5 thereunder, orders him liable for disgorgement of $153,675.65, which is the amount of illicit profits he earned as a result of the alleged illegal insider trading, plus $11,240.76 in interest, but provides that the disgorgement and interest obligation will be satisfied by the entry of a forfeiture order in the parallel criminal case.  The final judgment also imposes a lifetime officer-and-director bar on Stewart., Stewart, who pled guilty to criminal charges, also was <a href=https://www.sec.gov/litigation/admin/2017/34-81740.pdf>suspended</a> from appearing or practicing before the SEC as an accountant, which includes not participating in the financial reporting or audits of public companies., Stewarts son, Sean Stewart, was <a href=https://www.sec.gov/litigation/litreleases/2016/lr23620.htm>found guilty by a federal jury</a> of securities fraud and <a href=https://www.sec.gov/litigation/litreleases/2017/lr23757.htm>was sentenced</a> to three years imprisonment.  Sean Stewart has appealed his criminal conviction and the appeal remains pending.  The SECs action against Sean Stewart is pending and seeks permanent injunctions, disgorgement of ill-gotten gains plus interest, and civil penalties., The SEC thanks the U.S. Attorneys Office for the Southern District of New York and the Federal Bureau of Investigation for its efforts in prosecuting the criminal case against Robert and Sean Stewart, and the Financial Industry Regulatory Authority for its assistance in this matter.,  , <i>https://www.sec.gov/litigation/litreleases/2017/lr23948.htm</i><br/>]"
23949,2017,SEC Charges Accountant with Defrauding Investors Through Kickback Scheme,"[The Securities and Exchange Commission has charged an accountant with steering investors into buying shares of a public companys stock while receiving undisclosed kickbacks from the companys ex-Chairman., According to the SECs complaint, filed in federal court in Brooklyn, N.Y. on September 22, 2017, Brian C. Jensen, of Sandpoint, Idaho, solicited more than 25 of his accounting clients and attendees of investment conferences to buy more than $2 million in private placements of unregistered stock of ForceField Energy, a company that previously traded on the NASDAQ Capital Market.  The complaint alleges that the then-chairman of the board of ForceField, Richard St. Julien, paid Jensen kickbacks of approximately 10% of the value of the ForceField investments Jensen solicited, earning Jensen at least $127,000 in illegal kickbacks from St. Julien.  Jensen also obtained approximately $43,000 from ForceField stock that he sold., The SECs complaint also alleges that Jensen was not registered with the SEC to sell investments.  The SEC encourages investors to check the backgrounds of people selling investments by using the <a href=http://www.investor.gov/>SECs investor.gov website</a> to quickly identify whether they are registered professionals and confirm their identity., The SECs complaint charges Jensen with violating Sections 5 and 17(a) of the Securities Act of 1933 and Sections 10(b) and 15(a) of the Securities Exchange Act of 1934 and Rule 10b-5 thereunder.  Without admitting or denying the allegations in the SECs complaint, Jensen agreed to the entry of a partial judgment that permanently enjoins him from violating the charged provisions of the federal securities laws and permanently bars him from participating in penny stock offerings.  The court will decide the amount of disgorgement or civil penalties at a later date., The SEC <a href=https://www.sec.gov/news/pressrelease/2016-80.html>previously charged</a> 10 individuals with fraud, including St. Julien, for their involvement in schemes to trick investors into buying ForceField shares.  The SECs action remains stayed pending sentencings of the remaining defendants in the parallel criminal action., The SEC acknowledges the assistance of the U.S. Attorneys Office for the Eastern District of New York, the Federal Bureau of Investigation, and FINRA in this matter.,  , <i>https://www.sec.gov/litigation/litreleases/2017/lr23949.htm</i><br/>]"
23950,2017,SEC Charges Stock Promoter With Fraudulent Manipulation Scheme,"[The Securities and Exchange Commission today announced fraud charges against a Canadian man behind an alleged scheme to manipulate the shares of a penny stock., The SECs complaint alleges that Micheal A. Skerry, of New Westminster, British Columbia, Canada, illegally profited by manipulating the price and demand of Success Holding Group International, Inc., a penny stock whose securities were quoted on OTC Link, through a practice known as scalping. The SEC alleges that he entered into agreements with Success Holdings to provide investor relations services and to purchase shares of Success Holdings stock at a discount.  Skerry allegedly paid $36,000 to Success Holding in exchange for 360,000 shares of Success Holding stock and immediately began taking steps to generate interest in the company through a fraudulent campaign to drive up public demand for Success Holding stock.  Among other things, the SECs complaint alleges that Skerry posted misleading messages on public websites and sent blast emails to potential investors urging them to buy Success Holding stock without telling them that he owned the stock and intended to sell it at the earliest opportunity.  The SEC alleges that Skerry sold all his shares of Success Holding stock to the public for a profit of over $950,000.  Skerrys sales allegedly made up more than 60% of the trading volume during the period, including 100% of the trading volume on certain days., The SECs complaint charges Skerry with violating Sections 5 and 17(a) of the Securities Act of 1933, Section 10(b) of the Securities Exchange Act of 1934, and Rule 10b-5 thereunder.  The SEC seeks a permanent injunction, a penny stock bar, disgorgement, pre- and post-judgment interest, and a civil penalty. , The SEC also charged Success Holding with selling shares of its stock in an unregistered transaction to Skerry while knowing that he planned to immediately resell the shares to the public, and with failing to file Forms 10-Q or Forms 10-K for any periods since the period ended June 30, 2015. <a href=/litigation/admin/2017/33-10418.pdf>The SECs order</a> ffinds that Success Holding violated Section 5 of the Securities Act, Section 13(a) of the Exchange Act and Rules 13a-1 and 13a-13 thereunder.  Without admitting or denying the findings in the SECs order, Success Holding agreed to a cease-and-desist order and to pay disgorgement of $36,000, prejudgment interest of $3,737 and civil penalties of $100,000, for a total of $139,737 in four installments. Success Holding also agreed to bring its filings with the SEC current. The SEC also instituted <a href=/litigation/admin/2017/34-81751.pdf>administrative proceedings under Section 12(j) of the Exchange Act to revoke Success Holdings registration</a> in the event that Success Holding fails to bring its filings current. The SECs order stays the revocation proceedings to provide Success Holding time to comply., The SECs investigation was conducted by Jedediah B. Forkner and Wilburn Saylor, and was supervised by Anne C. McKinley in the Chicago Regional Office. The litigation against Skerry will be led by Michael Foster. The SEC appreciates the assistance of the Financial Industry Regulatory Authority and the British Columbia Securities Commission., <img alt= border=0 height=9 src=/images/arrowright_dkblue.gif width=10/><a href=/litigation/complaints/2017/comp23950.pdf>SEC Complaint</a>, <img alt= border=0 height=9 src=/images/arrowright_dkblue.gif width=10/><a href=/litigation/admin/2017/33-10418.pdf>Order - Success Holding Group International, Inc. (33-10418)</a>, <img alt= border=0 height=9 src=/images/arrowright_dkblue.gif width=10/><a href=/litigation/admin/2017/34-81751.pdf>Order - Success Holding Group International, Inc. (34-81751)</a>,  , <i>https://www.sec.gov/litigation/litreleases/2017/lr23950.htm</i><br/>]"
23951,2017,SEC Charges Investment Adviser With Stealing Money From Clients,"[The Securities and Exchange Commission today announced fraud charges against an investment adviser and an operations manager for stealing approximately $378,000 from clients., The SECs complaint alleges that Tarek D. Bahgat, a former resident of Williamsville, N.Y. who now lives in Egypt, misappropriated money from seven of his investment advisory clients, many of whom were senior citizens.  The SEC also alleges that, in some instances, Bahgat, by obtaining internet bill-paying privileges, impersonated his clients in telephone calls with broker-dealers holding the client accounts and caused money to be transferred from his clients accounts to himself or to WealthCFO LLC, a company Bahgat controlled.  The complaint further alleges that Lauramarie Colangelo, of Amherst, N.Y., WealthCFOs operations manager, posed as one of Bahgats clients during a telephone call with a broker-dealer., The SECs complaint, filed in the U.S. District Court for the Western District of New York, charges Bahgat with violating Sections 206(1) and 206(2) of the Investment Advisers Act of 1940 and Colangelo with aiding and abetting certain of Bahgats violations.  The complaint seeks permanent injunctions and civil penalties from Bahgat and Colangelo, and disgorgement plus interest from Bahgat.  The complaint names WealthCFO as a relief defendant for the purpose of disgorging illicit proceeds, plus interest, from the fraud in the companys possession., The SECs investigation was conducted by Gerald Gross and Eric Schmidt.  The litigation will be led by David Stoelting.  The case is being supervised by Sanjay Wadhwa., <img alt= border=0 height=9 src=/images/arrowright_dkblue.gif width=10/><a href=/litigation/complaints/2017/comp23951.pdf>SEC Complaint</a>, <b>Complaint</b>,  , <i>https://www.sec.gov/litigation/litreleases/2017/lr23951.htm</i><br/>]"
23952,2017,SEC Charges Technology Company Insider with Tipping Family Members Ahead of Acquisition,"[The Securities and Exchange Commission today charged a technology company insider with tipping off several family members in advance of the acquisition of another company., According to the SECs complaint, Anand Jayapalan, a SanDisk, Inc. employee, learned that SanDisk was entering into exclusive negotiations to acquire Fusion-io, Inc.  The SEC alleges that Jayapalan tipped his wife, Rajni Nair, and his uncle and aunt, Kumar Ananda and Vijaya Ananda, about the pending acquisition.  Prior to the public announcement of SanDisks acquisition of Fusion-io, the SEC alleges that the Anandas bought large amounts of Fusion-io stock, ultimately spending $665,778 to purchase approximately 78,900 shares using eight different brokerage accounts, including approximately 1,000 shares purchased through an account Vijaya Ananda shared with Nair.  The SEC alleges that Kumar primarily financed these purchases with a combination of stock sales and margin loans, and did so at a time when his medical practice was in substantial decline, he owed nearly $100,000 in credit card debt, and after he had suffered what he described as a drastic reduction in his personal income between 2012 and 2014, as his salary dropped by approximately one-third.  On June 16, 2014, the SEC alleges that SanDisk announced that it had offered to acquire Fusion-ios stock, causing the value of the companys stock to increase by approximately 22%, from $9.28 per share to $11.36 per share.  The SEC further alleges that once the news of the tender offer broke, the Anandas liquidated their shares, realizing $215,086 in illegal profits., The SECs complaint, filed in the U.S. District Court for the Central District of California, charges Jayapalan, Nair, and Kumar Ananda with violating Sections 10(b) and 14(e) of the Securities Exchange Act of 1934 and Rules 10b-5 and 14e-3 thereunder.  The complaint also charges Vijaya Ananda with violating Section 14(e) of the Exchange Act and Rule 14e-3 thereunder.  The SEC seeks permanent injunctions, disgorgement plus interest, and civil penalties., The SECs investigation was conducted by Tamar Braz, and supervised by Marc Blau.  The litigation will be led by Douglas Miller., The SEC appreciates the assistance of the Financial Industry Regulatory Authority., <img alt= border=0 height=9 src=/images/arrowright_dkblue.gif width=10/><a href=/litigation/complaints/2017/comp23952.pdf>SEC Complaint</a>,  , <i>https://www.sec.gov/litigation/litreleases/2017/lr23952.htm</i><br/>]"
23953,2017,SEC Charges Microcap Company and its Promoters in Pump-and-Dump Market Manipulation Scheme,"[The Securities and Exchange Commission today announced fraud charges against Jason McDiarmid, Kenneth George Cedric Telford, and Stop Sleep Go, Inc. (formerly known as Interactive Multi-Media Auction Corp) (IMMA), for their involvement in a pump-and-dump scheme affecting IMMAs stock., According to the complaint, McDiarmid and Telford incorporated IMMA and took it public through a 2013 Form S-1 registration statement, registering a public offering of the companys common stock by selling shareholders, including two of McDiarmids and Telfords nominees.  IMMAs Form S-1 and its amendments allegedly falsely claimed that IMMAs chief executive officer, McDiarmids friend who had no corporate experience, ran the company, when in fact it was secretly run by McDiarmid and Telford.  The complaint also alleges that the S-1s also included lies that certain selling stockholders purchased their shares in IMMA through private placements, which were sham transactions.  The complaint also alleges that, after learning that the SEC had subpoenaed testimony from the sister of IMMAs CEO, who was one of the parties in the sham transactions, McDiarmid suggested a script for her testimony, which included false information about her relationship with Telford., The complaint further alleges that once the Form S-1 went effective, McDiarmid repeated these lies, along with others, to a market maker for IMMAs stock, who included them in its successful application to obtain clearance from FINRA to quote IMMAs stock, which was needed for the company to be publicly traded., According to the complaint, McDiarmid and Telford opened brokerage accounts in the names of nominees in order to sell their stock and, when they deposited IMMA shares into the accounts, they lied about how much stock they owned, how they obtained it, and the relationship of the nominees to them.  McDiarmid and Telford also prepared IMMAs periodic filings made with the SEC, which largely repeated the same lies in the Forms S-1.  The complaint further alleges that McDiarmid and Telford organized and implemented a promotional campaign, including email blasts and a boiler room that targeted senior citizens.  IMMAs stock price increased, from $0.93 per share on September 30, 2014 to $1.62 per share on May 1, 2015, during which time McDiarmid and Telford dumped their shares through the nominees, earning them net illegal profits of about $3.1 million., The SECs complaint charges McDiarmid and Telford with violating Section 5(a) and 5(c) and Section 17(a) of the Securities Act of 1933, and Section 10(b) of the Securities and Exchange Act of 1934.  The complaint also seeks to hold McDiarmid and Telford liable as control persons under Section 20(a) of the Exchange Act.  The complaint also charges IMMA with violating Section 17(a)(1) and (a)(3) of the Securities Act and Section 10(b) of the Exchange Act and Rule 10b-5(a)-(c) thereunder., The SEC seeks permanent injunctions, disgorgement, interest, penalties, and officer-and-director bars and penny stock bars for McDiarmid and Telford., The SEC has issued an <a href=https://investor.gov/news-alerts/investor-alerts/investor-alert-fraudulent-stock-promotions>Investor Alert</a> warning investors that fraudsters may promote a stock to make profits for themselves at investors expense.  The alert notes that stock promotions may be conducted through email, and that email spam may indicate an email scam., The SECs investigation was conducted by Roberto Tercero and supervised by Spencer Bendell.  The SECs litigation will be handled by Amy Longo.  The SEC appreciates the assistance of the Financial Industry Regulatory Authority., <img alt= border=0 height=9 src=/images/arrowright_dkblue.gif width=10/><a href=/litigation/complaints/2017/comp23953.pdf>SEC Complaint</a>,  , <i>https://www.sec.gov/litigation/litreleases/2017/lr23953.htm</i><br/>]"
23954,2017,SEC Obtains Final Judgment Against Investment Bank VP Charged With Insider Trading,"[The Securities and Exchange Commission has obtained a final judgment against a former vice president in the risk management department of a New York-based investment bank <a href=https://www.sec.gov/news/press-release/2017-83>charged with</a> insider trading on confidential information he learned in advance of a private equity firms acquisition of a publicly-traded technology company., The final judgment, entered on September 26, 2017 by the Honorable Alison J. Nathan of the U.S. District Court for the Southern District of New York, permanently enjoins Avaneesh Krishnamoorthy from violating Section 17(a) of the Securities Act of 1933 and Section 10(b) of the Securities Exchange Act of 1934 and Rule 10b-5 thereunder.  The judgment also orders Krishnamoorthy liable for disgorgement of $78,712.80, which will be deemed satisfied by either the entry of a forfeiture order in the parallel criminal action or proof of payment of that amount to the U.S. Attorneys Office for the Southern District of New York.  The judgment also orders Krishnamoorthy to pay $1,216.28 in interest.  Krishnamoorthy has also agreed to lifetime bars from the securities industry and from participating in penny stock offerings., The SECs litigation was led by Alison Levine, Preethi Krishnamurthy and Thomas P. Smith, Jr. and was supervised by Sanjay Wadhwa.,  , <i>https://www.sec.gov/litigation/litreleases/2017/lr23954.htm</i><br/>]"
23955,2017,SEC Obtains Default Judgment Against Former Broker Charged with Defrauding Customers,"[The Securities and Exchange Commission announced today that it obtained a final judgment by default against a former broker <a href=https://www.sec.gov/news/press-release/2017-85>charged with</a> knowingly or recklessly trading unsuitable investment products in the accounts of five customers and stealing more than $170,000 from one of those customers.  The final judgment, entered on September 27, 2017 by the Honorable Alison J. Nathan of the U.S. District Court for the Southern District of New York, permanently enjoins Hallas from violating Section 17(a) of the Securities Act of 1933 and Section 10(b) of the Securities Exchange Act of 1934 and Rule 10b-5 thereunder.  The judgment also orders Hallas to pay $549,987.64 in disgorgement, prejudgment interest and civil penalties., The SECs litigation was led by Michael C. Ellis, David Stoelting and Thomas P. Smith, Jr. and was supervised by Sanjay Wadhwa.,  , <i>https://www.sec.gov/litigation/litreleases/2017/lr23955.htm</i><br/>]"
