lt_no,yr,title,lt
23789,2017,SEC Obtains Asset Freeze in Suspected Insider Trading on Mobileye N.V. Acquisition,"[The Securities and Exchange Commission today announced it has obtained an emergency court order to freeze the assets of two Israeli traders who used brokerage accounts in the U.S. to reap nearly $5 million in trading profits in advance of the March 13, 2017, announcement that Intel Corp. had agreed to acquire Israel-based Mobileye N.V., The SECs emergency action to freeze the proceeds of the traders highly suspicious transactions ensures that the potentially illegal profits cannot be removed from the accounts while the agencys investigation of the trading continues., According to the SECs complaint filed in federal court in New York, before market opening on Monday, March 13, Intel announced that it had agreed to acquire Mobileye through a tender offer for approximately $15.3 billion, or $63.54 per share. The announced purchase price was a 34.4 percent premium over Mobileyes closing price on Friday, March 10, of $47.27 per share.  After the announcement, Mobileye opened at its high for the day, $61.51, and closed at $60.62 per share, a 28 percent increase over its March 10 closing price., The SEC alleges that Ariel Darvasi and Amir Waldman were in possession of material nonpublic information about the impending acquisition when they purchased Mobileye securities.  On the morning of March 2, Darvasi liquidated all of the securities in his account and that afternoon, he purchased 30,000 shares of Mobileye worth nearly $1.4 million. On March 13, 2017, Darvasi sold 100 Mobileye shares for a realized gain of $1,473.45. The unrealized gain on his remaining 29,900 shares is approximately $427,000., The SEC alleges that Waldman began accumulating Mobileye call option contracts at strike prices above Mobileyes then current price starting on February 1, the same day that Intel and Mobileye executed a non-disclosure agreement. By February 28, Waldman had accumulated 7,012 call options contracts with strike prices ranging from $49 to $55. Mobileye last closed at or above $49 per share on August 23, 2016 and had not closed above $50 in the prior 17 months. Between March 1 and March 10, Waldman accumulated an additional 1,605 call options contracts with strike prices ranging from $49 to $55. As of March 10, Waldman spent $237,581 to acquire 5,339 Mobileye call options. After the announcement of the acquisition, Waldman sold 1,697 of his options contracts for a realized gain of approximately $1.54 million. Based on Mobileyes March 13 closing price, the unrealized gains on Waldmans currently held options is approximately $2.96 million., The emergency court order obtained by the SEC freezes the traders assets and prohibits the traders from destroying any evidence. The SECs complaint charges the traders with violating Sections 10(b) and 14(e) of the Securities Exchange Act of 1934 and Rules 10b-5 and 14e-3 thereunder. In addition to the emergency relief, the Commission is seeking a final judgment ordering the traders to disgorge their allegedly ill-gotten gains with interest, pay civil penalties, and be permanently enjoined from future violations., The expedited investigation is being conducted by Kevin M. Comeau and Jay A. Scoggins of the SECs Denver Regional Office, under the supervision of Kurt L. Gottschall, and Julie K. Lutz. The SECs litigation is being handled by Terry R. Miller and Greg A. Kasper. The SEC thanks the Financial Industry Regulatory Authority for its significant assistance in this matter., <img alt= border=0 height=9 src=/images/arrowright_dkblue.gif width=10/><a href=/litigation/complaints/2017/comp23789.pdf>SEC Complaint</a>,  , <i>https://www.sec.gov/litigation/litreleases/2017/lr23789.htm</i><br/>]"
23790,2017,Overseas Traders Paying Back All Profits Plus Penalties In Insider Trading Case,"[The Securities and Exchange Commission today announced that three Peruvian traders have agreed to settle a pending case alleging that they traded on nonpublic information prior to the merger of two mining companies., The <a href=https://www.sec.gov/news/pressrelease/2016-198.html>SEC filed its complaint in September 2016</a>, and the settlements were approved today in U.S. District Court for the Southern District of New York., Nino Coppero del Valle, the alleged tipper who worked at one of the companies, agreed to pay full disgorgement of $53,607.70 plus interest of $5,382.44.  His close friend and fellow attorney Julio Antonio Castro Roca agreed to pay full disgorgement of $59,300.02 plus $5,514.97 in interest and a $59,300.02 penalty.  The other trader, Ricardo Carrion, agreed without admitting or denying the allegations to pay full disgorgement of $54,144.10 plus $5,820.29 in interest and a $54,144.10 penalty., The final judgments also obtain permanent injunctive relief from each of the three defendants., The SECs litigation was led by Jorge G. Tenreiro, Preethi Krishnamurthy, and Thomas P. Smith Jr.  The case was supervised by Sanjay Wadhwa.  The SEC appreciates the assistance of the Peruvian securities regulator Superintendencia del Mercado de Valores., For further information, see Litigation Release No. <a href=https://www.sec.gov/litigation/litreleases/2016/lr23660.htm>23660</a> (Sept. 29, 2016).,  , <i>https://www.sec.gov/litigation/litreleases/2017/lr23790.htm</i><br/>]"
23791,2017,SEC HALTS BOILER ROOM SCHEME INVOLVING STATE LOTTERY TICKETS,"[The Securities and Exchange Commission today announced charges against a Florida-based company, its CEO, and its top sales agent accused of conducting a boiler room scheme that solicits investments in a business purportedly facilitating online and cell phone sales of lottery tickets in various states., The SEC has obtained an emergency court order freezing the assets of LottoNet Operating Corp., David Gray, and Joseph A. Vitale. The SECs complaint alleges that they misrepresented to investors that their money would be used to develop and market LottoNet and that sales agents did not receive commissions. At least 35 percent of investor proceeds were allegedly paid to boiler room sales agents in the form of commissions, and LottoNet allegedly siphoned investor funds for personal spending on clothing, wedding-related expenses, and strip clubs., According to the SECs complaint, which was unsealed in federal court today, among the pitches used in sales agent scripts prepared for cold calls to investors was youre looking at a monthly dividend payout of $8,500 every month on a $25,000 investment if LottoNet reaches 1 percent market share. The scripts also allegedly touted the purported safety of the investment, noting a 60 percent return as a worst case scenario if the company was ever sold. The SEC alleges that while LottoNet has raised a total of approximately $4.8 million from investors, the company had only paid $10,525.43 in investment returns to investors through the end of February. Sales agents allegedly have been paid more than $1.1 million out of investor funds., The SECs complaint further alleges that Vitale, who personally raised at least $1.4 million from investors, used the alias Donovan Kelly in an apparent attempt to hide from investors that he is permanently barred by the Financial Industry Regulatory Authority (FINRA)., The SECs investigation, which is continuing, has been conducted in the Miami office by Kate Zoladz, Gary Miller, and Allen J. Genaldi. The case is being supervised by Elisha L. Frank and the litigation is being led by Amie Riggle Berlin. The SEC appreciates the assistance of FINRA., ,  , <i>https://www.sec.gov/litigation/litreleases/2017/lr23791.htm</i><br/>]"
23792,2017,Court Enters Judgment Against Operator of Ponzi Scheme that Claimed to Offer Bridge Loans to Jamaican Businesses,"[The Securities and Exchange Commission today announced that the U.S. District Court for the District of Massachusetts entered a final judgment by default against former Boston resident Mark Anderson Jones, in a case alleging that he operated a nearly $10 million Ponzi scheme involving purported bridge loans to Jamaican businesses.  Among other things, the court ordered Jones to pay more than $3.9 million of allegedly ill-gotten gains, prejudgment interest, and civil penalties., On March 15, 2016, the SEC filed a civil injunctive action in federal court in Boston alleging that from approximately 2007 through 2015, Jones raised money by issuing promissory notes and personal guarantees to around 21 investors in several states and Washington, D.C.  Jones allegedly solicited investors to invest in an enterprise he called The Bridge Fund that purportedly provided high-yielding bridge loans to Jamaican businesses waiting for funding from approved commercial bank loans.  The SEC alleged that, instead of investing the money as he had promised, Jones used a large portion to make Ponzi payments to other investors and some to pay for his own personal expenses. The complaint alleged that many of the investors are retirees who are not sophisticated investors.  Jones is alleged to have issued periodic account statements to investors, some of whom routinely received payments, while others rolled over the accrued interest in their accounts.  Beginning in 2015, Jones allegedly failed to make certain interest payments.  According to the complaint, in July 2015, an attorney representing Jones informed many of the investors that Jones had used their funds for personal living expenses and to pay other investors.  The complaint further alleged that evidence from Jones bank records supports the admission made on behalf of Jones by his attorney that he used investor funds to pay other investors., In its order, the court permanently enjoined Jones from violating Section 17(a) of the Securities Act of 1933 and Section 10(b) of the Securities Exchange Act of 1934 and Rule 10b-5 thereunder.  In addition, the court also ordered Jones to disgorge $3,586,510 of profits gained as a result of the conduct alleged, prejudgment interest of $236,463.48, and to pay a civil penalty of $160,000., The SECs case litigation was handled by Frank Huntington, J. Lauchlan Wash, Xinyue Angela Lin, Sofia Hussain, and Amy Gwiazda in the SECs Boston Regional Office., For further information, see <a href=https://www.sec.gov/litigation/litreleases/2016/lr23490.htm>Litigation Release No. 23490</a> (March 16, 2016) [Civil Complaint].,  , <i>https://www.sec.gov/litigation/litreleases/2017/lr23792.htm</i><br/>]"
23793,2017,SEC Charges Environmental Services Company and Former Chief Financial Officer For Accounting Failures,"[The Securities and Exchange Commission today charged the former CFO of a Colorado-based environmental solutions company with accounting and books and records violations., The SECs complaint, filed in federal court in the District of Columbia, alleges that Mark McKinnies approved Advanced Emissions Solutions, Inc.s filing of false and misleading financial statements from at least 2011 through 2013 and oversaw the inaccurate recording of transactions in the companys books and records.  The SEC alleges that Advanced Emissions:, In a restatement filed in 2016, the company corrected for these and other errors., McKinnies agreed, without admitting or denying the allegations in the SECs complaint, to be permanently enjoined from violating Sections 17(a)(2) and (3) of the Securities Act of 1933 and Rule 13b2-1 under the Securities Exchange Act of 1934, to be barred from acting as an officer or director of a public company for five years, and to pay disgorgement, prejudgment interest and a penalty totaling $238,692.  The settlement is subject to court approval.  McKinnies also has agreed to be suspended from appearing and practicing before the SEC as an accountant, which includes not participating in the financial reporting or audits of public companies.  The SECs order would permit McKinnies to apply for reinstatement after five years., Advanced Emissions separately consented to the entry of an SEC order instituting cease-and-desist proceedings.  According to the SECs order, from at least 2011 through 2013, Advanced Emissions issued false and misleading financial statements.  The companys internal control over financial reporting also was deficient.  The SECs order finds that Advanced Emissions violated Sections 17(a)(2) and (3) of the Securities Act, Sections 13(a) and 13(b)(2)(A) and (B) of the Exchange Act, and Rules 12b-20, 13a-1, 13a-11, and 13a-13 thereunder.  Advanced Emissions agreed to entry of a cease-and-desist order and to pay a $500,000 penalty.  The SEC considered Advanced Emissions cooperation in determining to accept the offer., The SECs investigation was conducted by Ian Dattner, Donato Furlano and Duane K. Thompson and supervised by Lisa Deitch, Peter Rosario and Antonia Chion., <img alt= border=0 height=9 src=/images/arrowright_dkblue.gif width=10/><a href=/litigation/complaints/2017/comp23793.pdf>SEC Complaint</a>, <img alt= border=0 height=9 src=/images/arrowright_dkblue.gif width=10/><a href=/litigation/admin/2017/33-10329.pdf>SEC Order</a>,  , <i>https://www.sec.gov/litigation/litreleases/2017/lr23793.htm</i><br/>]"
23794,2017,SEC Obtains TRO and Asset Freeze in Investment Scheme Involving Seniors,"[The Securities and Exchange Commission today announced an emergency asset freeze and temporary restraining order against a Chicago-based investment adviser and his financial management company accused of scamming elderly investors out of millions of dollars., The SEC alleges that Daniel H. Glick and his unregistered investment advisory firm Financial Management Strategies (FMS) provided clients with false account statements to hide Glicks use of client funds to pay personal and business expenses, purchase a Mercedes-Benz, and pay off loans and debts among other misuses., According to the SECs complaint, Glick was barred by FINRA in 2014 and had his Certified Financial Planner designation and Certified Public Accountant license revoked for conduct unrelated to todays SEC charges., The SECs complaint also names Glick Accounting Services, Glicks business partner David B. Slagter, and Glicks business acquaintance Edward H. Forte as relief defendants for the purposes of recovering client funds that Glick transferred or paid them in the form of advances or loans., The complaint alleges that Glick and FMS violated Section 17(a) of the Securities Act of 1933, Section 10(b) of the Securities Exchange Act of 1934 and Rule 10b-5 thereunder, and Sections 206(1) and 206(2) of the Investment Advisers Act of 1940., The court issued a temporary restraining order against Glick and FMS at the SECs request, and issued an order freezing the assets of Glick, FMS, and Glick Accounting Services., The SECs investigation, which is continuing, is being conducted by Michelle MuÃ±oz Durk and John Kustusch, and the case is being supervised by Jeffrey A. Shank.  The SECs litigation will be led by Steven C. Seeger.  The SECs examination that led to the investigation was conducted by Terrence Bohan, Michael Altschuler, and Christine Little, and it was supervised by Rosanne Smith., , <img alt= border=0 height=9 src=/images/arrowright_dkblue.gif width=10/><a href=/litigation/complaints/2017/comp23794.pdf>SEC Complaint</a>,  , <i>https://www.sec.gov/litigation/litreleases/2017/lr23794.htm</i><br/>]"
23795,2017,SEC Obtains Final Judgment Against Clayton A. Cohn,"[The Securities and Exchange Commission announced today that it has obtained a final judgment against Clayton A. Cohn, a former Marine accused of masquerading as a successful trader to defraud fellow veterans, current military, and other investors., On August 6, 2013, the SEC obtained <a href=https://www.sec.gov/news/press-release/2013-149>an emergency court order</a> to halt an alleged hedge fund investment scheme orchestrated by Cohn through his investment adviser, Marketaction Advisors, LLC.  According to <a href=http://www.sec.gov/litigation/complaints/2013/comp-pr2013-149.pdf>the SECs complaint</a>, Cohn raised nearly $1.8 million from investors through his hedge fund by lying to investors about his success as a trader, the performance of the hedge fund, his use of investor proceeds, and his personal stake in the hedge fund.  The complaint alleges that Cohn invested less than half of the money raised from investors and used more than $400,000 for personal expenses and to fund a luxurious lifestyle.  Cohn allegedly used his lavish lifestyle to portray himself as a successful trader and investor, when in reality he lost nearly all of the money invested.  According to the SECs complaint, in order to cover up his trading losses and misappropriation of investor funds, Cohn generated phony hedge fund account statements that claimed annual returns of nearly 200%., Cohn separately was charged criminally based on the same conduct alleged in the SECs complaint.  On July 5, 2016, Cohn pleaded guilty and, on January 24, 2017, <a href=https://www.sec.gov/litigation/litreleases/2017/lr23733.htm>Cohn was sentenced</a> to 52 months in prison, to be followed by two years of supervised release, and was ordered to pay $1,556,488.11 in restitution to defrauded investors., The final judgment, entered on March 30, 2017 by the Honorable Milton I. Shadur of the U.S. District Court for the Northern District of Illinois, permanently enjoins Cohn from violating Sections 5 and 17(a) of the Securities Act of 1933, Section 10(b) of the Securities Exchange Act of 1934 and Rule 10b-5 thereunder, and Sections 206(1), 206(2), and 206(4) of the Investment Advisers Act of 1940 and Rule 206(4)-8 thereunder, and orders him liable for $1,556,488.11 in disgorgement, payment of which is deemed satisfied by the entry of the criminal restitution order.  The SEC also dismissed its claims against Marketaction Advisors, LLC, since the entity is defunct and has no assets.  The courts entry of this judgment resolves the SECs action in its entirety., The SEC acknowledges the assistance of the U.S. Attorneys Office for the Northern District of Illinois and the Federal Bureau of Investigation.,  , <i>https://www.sec.gov/litigation/litreleases/2017/lr23795.htm</i><br/>]"
23796,2017,SEC Obtains Final Judgment Against Rhode Island-Based Issuer of 38 Studios Bonds,"[The Securities and Exchange Commission announced that it has obtained a final judgment against defendant Rhode Island Commerce Corporation (RICC) in a previously-filed enforcement action., In March 2016, <a href=https://www.sec.gov/news/pressrelease/2016-37.html>the SEC charged</a> the RICC with defrauding investors when it served as the issuer in a bond offering to finance startup video game company 38 Studios. The SECs complaint against the RICC and four other defendants, including the underwriter of the bonds, the lead banker for the underwriter, and two then-RICC executives, alleged that the RICC issued $75 million in bonds for the 38 Studios project as part of a state government program intended to spur economic development and increase employment opportunities by loaning bond proceeds to private companies. The SEC alleged that the defendants failed to disclose, among other things, that the project being financed by the bonds, the development of a video game, could not be completed with the financing the bonds would provide. The SEC also alleged that the defendants did not disclose that even with the proceeds of the loan financed by the 38 Studios Bonds, 38 Studios faced a known shortfall in funding., The RICC consented to the entry of the judgment without admitting or denying the allegations. The judgment, entered on April 3, 2017 by the Honorable John J. McConnell, Jr. in federal court in Rhode Island, enjoins the RICC from violating Sections 17(a)(2) and (a)(3) of the Securities Act of 1933 and orders the RICC to pay a $50,000 penalty., The SECs litigation continues against the underwriter and the underwriters lead banker. The SECs investigation was conducted by its Public Finance Abuse Unit, including Louis Randazzo, Joseph Chimienti, Jonathan Wilcox, Kevin B. Currid, and Deputy Chief Mark Zehner. The SECs litigation is being led by Kathleen B. Shields, Rua Kelly, and Mr. Randazzo of the Boston Regional Office.,  , <i>https://www.sec.gov/litigation/litreleases/2017/lr23796.htm</i><br/>]"
23797,2017,"Court Orders Boston Area Resident to Pay Over $590,000 in Insider Trading Action","[On April 3, 2017, the SEC obtained a final judgment against defendant Vlad B. Spivak, a Boston area resident, in an insider trading action, ordering him to pay more than $590,000 in monetary sanctions., The <a href=https://www.sec.gov/litigation/litreleases/2015/lr23398.htm>SECs complaint</a>, filed in federal court in Boston, Mass. on November 2, 2015, alleged that, in 2011, Vlad B. Spivak traded in the securities of American Dental Partners, Inc. (ADPI) on the basis of tips of material nonpublic information that he received from his then-romantic partner, Shirmila O. Doddi, who was employed as a financial analyst at a commercial bank. Doddi allegedly provided Spivak with material, nonpublic information she obtained through her position at the bank concerning ADPIs impending acquisition by a private equity firm and, based on this alleged unlawful tip, Spivak traded in ADPI securities and obtained illegal profits of over $222,000. Doddi did not trade in ADPI stock., The SECs complaint charged Spivak and Doddi with violating Section 10(b) of the Securities Exchange Act of 1934 and Rule 10b-5 thereunder. The final judgment against Spivak, which was entered by the Honorable F. Dennis Saylor IV of the United States District Court for the District of Massachusetts, permanently enjoins Spivak from future violations of the charged provisions of the federal securities laws. The judgment also orders him to pay disgorgement of $222,357 - representing his illegal profits - plus prejudgment interest, and a civil penalty in the amount of $333,535, which equals 150 percent of his profits. Spivak consented to the entry of the final judgment. The courts entry of the final judgment against Spivak concludes this litigation., Doddi <a href=https://www.sec.gov/litigation/litreleases/2016/lr23455.htm>previously settled</a> the SECs charges against her by agreeing to the entry of a final judgment that permanently enjoined her from violating the charged provisions of the federal securities laws and deferred consideration of monetary sanctions until the conclusion of the litigation against Spivak. As a result of Doddis significant cooperation in the SECs investigation and litigation, and in light of the final judgment ordering Spivak to pay full disgorgement of the illegally gained profits, the SEC will not seek monetary sanctions against Doddi., The SECs investigation was conducted by Jason Litow with assistance from Kevin Gershfeld in the Office of Market Intelligence-Surveillance. The investigation was supervised by Yuri B. Zelinsky and Antonia Chion. The SECs litigation was conducted by Jan Folena and John Worland. The SEC acknowledges the assistance and cooperation of the Financial Industry Regulatory Authority.,  , <i>https://www.sec.gov/litigation/litreleases/2017/lr23797.htm</i><br/>]"
23798,2017,SEC Charges Businesswoman with Operating a Fraudulent Promissory Note Scheme,"[The Securities and Exchange Commission today announced fraud charges against a Niles, Illinois businesswoman accused of misappropriating investor funds., The <a href=/litigation/complaints/2017/comp23798.pdf>SECs complaint</a>, filed in federal court in the Northern District of Illinois, alleges that Lucita A. Zamoras solicited investors for a promissory note program and subsequently misappropriated the investors funds.  From at least October 2009 through December 2013, Zamoras engaged in a fraudulent scheme in which she raised approximately $727,049 from at least six investors by encouraging them to transfer their retirement accounts to self-directed individual retirement accounts and purchase promissory notes issued by her.  Zamoras, originally from the Philippines, preyed on other Filipino investors by convincing the investors to purchase the notes, which offered them 3.5% to 5% annual interest.  The SEC complaint alleges that Zamoras never invested her clients funds; instead she used the money to support her gambling habit and pay other personal expenses., The SECs complaint charges Zamoras with violating Sections 17(a)(1) and 17(a)(3) of the Securities Act of 1933, Section 10(b) of the Securities Exchange Act of 1934 and Rule 10b-5(a) and (c) thereunder. The complaint seeks injunctive relief, disgorgement, prejudgment interest and a civil penalty against the Zamoras., The SECs investigation was conducted by Paul Feindt and Scott Frost.  The SECs litigation will be led by Daniel Wadley and Amy Oliver.,  , <i>https://www.sec.gov/litigation/litreleases/2017/lr23798.htm</i><br/>]"
