lt_no,yr,title,lt
23869,2017,"SEC Charges Former Chief Operating Officer of Oxford City Football Club, Inc. in Offering Fraud","[The Securities and Exchange Commission today announced fraud charges against the former Chief Operating Officer of a Florida-based penny stock company that falsely claimed to be the largest publicly traded diversified portfolio of professional sports teams in the world., The SECs complaint alleges that, from approximately July 2013 to July 2015, Diana P. Lovera and others at Oxford City used pressure tactics and a boiler room of salespeople to raise approximately $6.6 million from more than 150 investors, many of whom were unaccredited, through the sale of millions of unregistered shares of Oxford City stock. The complaint alleges that, in connection with these unregistered stock offerings, Lovera made numerous misstatements to investors about Oxford Citys assets, its business plan, its future profitability, and the composition of its management. The complaint further alleges that Lovera and others falsely told prospective investors they could lock in a discounted price on Oxford City stock using the companys voice verification system, which they claimed linked the investors personal information to a filing with the SEC. In reality, the complaint alleges, there was no such voice verification system; Lovera and others merely pressed buttons on a telephone key pad to mimic a recording device., Lovera was charged criminally in a parallel case. She pled guilty to conspiracy to commit mail and wire fraud and was sentenced to 20-month prison term, which she is now serving, and ordered to pay, jointly and severally with other defendants, approximately $6.31 million in restitution., The complaint, filed in the U.S. District Court for the Southern District of Florida, charges Lovera with violating Section 10(b) of Securities Exchange Act of 1934, Rule 10b-5 thereunder, and Sections 5(a), 5(c) and 17(a) of the Securities Act of 1933. To settle the charges, Lovera agreed to the entry of a final judgment, subject to court approval, that permanently enjoins her from violating the charged provisions of the federal securities laws; imposes a conduct-based injunction, a penny stock bar, and an officer-and-director bar; and orders her to pay disgorgement of $81,374 plus prejudgment interest of $3,343, which will be deemed satisfied by the restitution order entered against her in the criminal case. Lovera also consented to an SEC order imposing a permanent associational bar., The SEC <a href=https://www.sec.gov/news/pressrelease/2015-278.html>previously charged</a> Oxford City and its former CEO, Thomas Anthony Guerriero, and a relief defendant owned by Guerriero. Earlier this year, the SEC <a href=https://www.sec.gov/litigation/litreleases/2017/lr23745.htm>obtained final judgments</a> against Oxford City, Guerriero, and the relief defendant. Guerriero also pled guilty to conspiracy to commit wire and mail fraud and was sentenced to a 12 1/2 year prison term., The SEC thanks the U.S. Attorneys Office for the Southern District of Florida and the Federal Bureau of Investigation for their assistance in this matter., <img alt= border=0 height=9 src=/images/arrowright_dkblue.gif width=10/><a href=/litigation/complaints/2017/comp23869.pdf>SEC Complaint</a>,  , <i>https://www.sec.gov/litigation/litreleases/2017/lr23869.htm</i><br/>]"
23870,2017,SEC Files Fraud Charges in Bitcoin and Office Space Investment Schemes,"[The Securities and Exchange Commission today filed fraud charges against the clandestine founder of a purported Bitcoin platform and a chain of co-working spaces located in former bars and restaurants, alleging that he bilked investors in both companies while hiding his connection given his checkered past with regulators in the U.K., The SEC alleges that Renwick Haddow, a U.K. citizen living in New York, created a broker-dealer and did not register the firm with the SEC as required under the federal securities laws.  Haddow allegedly used sales representatives to cold call potential investors and sell securities in Bitcoin Store Inc. and Bar Works Inc., According to the SECs complaint, offering materials presented to investors in both companies touted the backgrounds of senior executives who do not appear to exist.  The materials also misrepresented other key facts about both companies operations.  Haddow allegedly diverted more than 80 percent of the in funds raised by the broker-dealer for the Bitcoin Store, and sent more than $4 million from the Bar Works bank accounts to one or more accounts in Mauritius and $1 million to one or more accounts in Morocco., The SEC alleges that materials provided to Bitcoin Store investors claimed it was an easy-to-use and secure way of holding and trading Bitcoin and had generated several million dollars in gross sales.  In fact, the SEC alleges that Bitcoin Store has never had any operations nor generated the gross sales it touted.  In 2015, for example, Bitcoin Stores bank accounts allegedly received less than $250,000 in incoming transfers, none of which appear to reflect revenue from customers.  According to the SECs complaint, the corporate address used for Bitcoin Store was Haddows residential address minus the apartment number., According to the SECs complaint, Bar Works claimed to bring real vibrancy to the flexible working scene by adding full-service workspaces to former bar and restaurant premises in central city locations.  Bar Works primarily sold leases coupled with sub-leases that together functioned like investment notes.  The company also allegedly sold leases for more workspaces than actually existed in at least two locations.  Among false claims made to investors, who invested more than $37 million in the Bar Works scheme, were that a location was profitable within months of opening and that Bar Works had engaged an auditor., In a parallel action, the U.S. Attorneys Office for the Southern District of New York today announced criminal charges against Haddow., The SECs complaint filed in federal district court in Manhattan charges Haddow, Bitcoin Store, Bar Works, and another Haddow-controlled company called Bar Works 7th Avenue, Inc. with violating Section 17(a) of the Securities Act of 1933 and Section 10(b) of the Securities Exchange Act of 1934 and Rule 10b-5.  The complaint further alleges that Haddow is liable for aiding and abetting Bitcoin Store, Bar Works, and Bar Works 7th Avenues violations and as a control person for the registration violations of his brokerage firm InCrowd Equity Inc., The SEC has obtained an emergency asset freeze against all defendants and relief defendants in the case., The SECs investigation is being conducted by Maureen P. King, Preethi Krishnamurthy, Neil Hendelman, and Sandeep Satwalekar.  The case is being supervised by Lara Shalov Mehraban.  The litigation will be handled by Ms. Krishnamurthy, Ms. King, and Christopher J. Dunnigan.  The SEC appreciates the assistance of the U.S. Attorneys Office for the Southern District of New York and the Federal Bureau of Investigation., <img alt= border=0 height=9 src=/images/arrowright_dkblue.gif width=10/><a href=/litigation/complaints/2017/comp-pr2017-123.pdf>SEC Complaint</a>,  , <i>https://www.sec.gov/litigation/litreleases/2017/lr23870.htm</i><br/>]"
23871,2017,Court Enters Final Judgment Against Former Pharmaceutical Company Executive and Friend For Insider Trading,"[The Securities and Exchange Commission today announced that the Honorable Jacqueline Scott Corley, U.S. Magistrate Judge for the Northern District of California, entered a final judgment as to Sasan Sabrdaran, the former director of drug safety risk management at Brisbane, California-based InterMune, Inc., and his long-time friend, Farhang Afsarpour.  The final judgment orders payment of disgorgement and prejudgment interest and imposes an officer and director bar following a jury verdict that found both defendants had engaged in insider trading., As shown at trial, Sabrdaran tipped Afsarpour in 2010 with confidential details while Sabrdaran was involved with shepherding InterMunes application before a European Union regulatory body to market an InterMune drug called Esbriet to be used for the treatment of patients with a type of fatal lung disease.  Afsarpour then acted on that tip by purchasing InterMune common stock on a U.S. stock exchange through his U.S.-based stockbroker and by purchasing spread bets on the future price movement in InterMune common stock or options through a U.K-based spread-betting firm.  Afsarpour also tipped friends who gave him money with which he purchased certain of the spread bets through his account or who purchased InterMune common stock, options, or spread bets through their own accounts., On November 14, 2016, a jury returned a verdict in favor of the SEC and against Sabrdaran and Afsarpour.  Sabrdaran and Afsarpour were found liable for insider trading in violation of Section 10(b) of the Securities Exchange Act of 1934 and Rule 10b-5(b)., The Courts final judgment, entered June 15, 2017, orders Afsarpour to pay $386,671.99 in disgorgement, of which Sabrdaran is jointly and severally liable for payment of up to $288,968.19, and orders Afsarpour to pay $69,919.93 in prejudgment interest.  The final judgment also bars Sabrdaran from acting as an officer or director of any SEC-reporting company.  In finding Sabrdaran unfit to serve as an officer of director, the  Court observed that [t]ime and time again, when faced with difficult questions, Dr. Sabrdaran declined to tell the truth and that over the course of the SECs investigation and during trial he engage[d] in dishonest misconduct., This concludes the SECs federal district court litigation., Kenneth W. Donnelly and James E. Smith, under the supervision of Frederick L. Block, led the SECs litigation with the assistance of Drew Panahi, who conducted the underlying investigation, and Victor Tabak.,  , <i>https://www.sec.gov/litigation/litreleases/2017/lr23871.htm</i><br/>]"
23872,2017,"SEC Charges Washington, D.C.-based Real Estate Agent and Sister of Convicted Ponzi Scheme Operator with Selling Unregistered Securities","[The Securities and Exchange Commission today announced charges against Cheryl L. Jones, a Washington, D.C.-based real estate agent and the sister of convicted Ponzi scheme operator Mark A. Jones, for selling unregistered securities., The SECs complaint, filed in federal court in Boston, alleges that Cheryl Jones recruited many of her friends and associates to invest in unregistered promissory notes and personal guarantees that Mark Jones issued in connection with his Ponzi scheme. Mark Jones allegedly claimed that investors money would be pooled to provide short-term bridge loans to Jamaican companies that had supposedly been approved for commercial bank loans but needed interim financing until their bank loan funding came through. Mark Jones allegedly told investors that their investments would earn interest of approximately 15% to 24% annually. Instead, as the complaint alleges, Mark Jones deposited the investors money in his personal bank account and diverted almost all of it for personal expenses and to make Ponzi payments to other investors. The complaint also alleges that Mark Jones agreed to pay Cheryl Jones commissions of approximately 10% of the principal invested by new investors she referred to him. He also allegedly paid her a monthly legal retainer for services to him or the Bridge Fund. The complaint further alleges that between 2007 and 2015, Cheryl Jones was wrongfully enriched when she received payments from her brother totaling approximately $515,000 more than her approximately $876,000 investment in the Bridge Fund. Other investors lost substantial portions of their investments., Cheryl Jones brother, Mark Jones, <a href=https://www.sec.gov/litigation/litreleases/2016/lr23648.htm>pled guilty to criminal charges</a> arising from his operation of the Ponzi scheme and was <a href=https://www.sec.gov/litigation/litreleases/2016/lr23648.htm>sentenced to 70 months imprisonment</a>. The SEC <a href=https://www.sec.gov/news/pressrelease/2016-55.html>charged Jones with securities fraud</a> and <a href=https://www.sec.gov/litigation/litreleases/2017/lr23792.htm>obtained a default judgment</a>., The SECs complaint charges Cheryl Jones with violating Section 5 of the Securities Act of 1933. The SEC seeks a permanent injunction against Cheryl Jones, disgorgement of her ill-gotten gains plus prejudgment interest, and a civil penalty., The SECs action is being handled by Frank Huntington, Xinyue Angela Lin, J. Lauchlan Wash, Sofia Hussain and Amy Gwiazda of the Boston Regional Office., <img alt= border=0 height=9 src=/images/arrowright_dkblue.gif width=10/><a href=/litigation/complaints/2017/comp23872.pdf>SEC Complaint</a>,  , <i>https://www.sec.gov/litigation/litreleases/2017/lr23872.htm</i><br/>]"
23873,2017,Final Judgments and Restitution Orders Entered Against Former Officers of Massachusetts-Based Information Technology Company,"[On June 27, 2017, the Honorable Douglas P. Woodlock of the U.S. District Court for the District of Massachusetts entered final judgments against the former CEO and CFO of a Massachusetts-based information technology company., The SEC <a href=https://www.sec.gov/litigation/litreleases/2010/lr21735.htm>charged</a> Jon Latorella of Marblehead, Massachusetts and James C. Fields of Brookline, Massachusetts with fraud for falsifying LocatePlus Holdings Corp.s financial reporting. The final judgments, entered on June 27, 2017 by the Honorable Douglas P. Woodlock of the U.S. District Court for the District of Massachusetts, enjoin both Latorella and Fields from violating Sections 5 and 17(a) of the Securities Act of 1933, Sections 10(b), 13(a), 13(b)(2)(A) and (B), and 13(b)(5) of the Securities Exchange Act of 1934 and Exchange Act Rules 10b-5, 12b-20, 13a-1, 13a-11, 13a-13, 13b2-1 and 13b2-2 and impose penny stock and officer-and-director bars., <a href=https://www.sec.gov/litigation/litreleases/2012/lr22394.htm>Latorella</a> and <a href=https://www.sec.gov/litigation/litreleases/2013/lr22629.htm>Fields</a> also were charged criminally. Both Latorella and Fields were each sentenced to 60 months imprisonment and ordered to make approximately $4.9 million in restitution, on a joint and several basis. In the criminal restitution order, the court noted that it was not imposing disgorgement in the SECs case because it would be duplicative of the restitution order., LocatePlus has filed for bankruptcy protection and <a href=https://www.sec.gov/litigation/litreleases/2012/lr22426.htm>has settled the SECs charges</a>., The courts entry of the final judgments against Latorella and Fields resolve this litigation in its entirety.,  , <i>https://www.sec.gov/litigation/litreleases/2017/lr23873.htm</i><br/>]"
23874,2017,SEC Obtains Final Judgment Against CEO Charged with Accounting Fraud and Other Accounting Failures,"[The Securities and Exchange Commission announced that it has obtained a final judgment against Ryan Petersen, the former chief executive officer of OCZ Technology Group Inc. whom the SEC charged with an accounting fraud at the now-bankrupt seller of computer memory storage and power supply devices., The final judgment, entered by the Honorable Richard Seeborg, U.S. District Judge, U.S. District Court for the Northern District of California on June 30, 2017, permanently enjoins Petersen from violating Section 17(a) of the Securities Act of 1933, Sections 10(b) and 13(b)(5) of the Securities Exchange Act of 1934, and Exchange Act Rules 10b-5, 13a-14, 13b2-1, and 13b2-2, and aiding and abetting violations of Exchange Act Sections 13(a), 13(b)(2)(A) and 13(b)(2)(B), and Exchange Act Rules 12b-20, 13a-1, 13a-11, and 13a-13.  The judgment also bars Petersen from acting as an officer or director of a public company, and orders him to pay $121,600 in disgorgement and relief pursuant to Section 304(a) of the Sarbanes-Oxley Act of 2002, prejudgment interest on the disgorgement of $18,400, and a civil penalty in the amount of $100,000.  Petersen consented to the final judgment., The courts entry of the judgment against Petersen resolves this litigation in its entirety., The SEC <a href=https://www.sec.gov/news/pressrelease/2015-234.html>charged Petersen</a> with engaging in a scheme to materially inflate OCZs revenues and gross margins from 2010 to 2012.  The agency <a href=https://www.sec.gov/news/pressrelease/2015-234.html>separately charged OCZs former chief financial officer, Arthur Knapp</a>, with certain accounting, disclosure, and internal accounting controls failures at OCZ.  Knapp agreed to settle the SECs charges without admitting or denying the allegations against him and, on October 23, 2015, the SEC <a href=https://www.sec.gov/litigation/admin/2015/34-76250.pdf>suspended Knapp</a> from appearing or practicing before the SEC as an accountant, which includes not participating in the financial reporting or audits of public companies.  On August 29, 2106, the SEC <a href=https://www.sec.gov/litigation/admin/2016/34-78711-s.pdf>suspended Thomas Dulek</a>, a California-based accountant, from appearing and practicing before the SEC as an accountant, which includes not participating in the financial reporting or audits of public companies, based on his violations of important auditing standards.  The SECs investigation found that Dulek conducted deficient audits of OCZs financial statements for fiscal years 2011 and 2012.,  , <i>https://www.sec.gov/litigation/litreleases/2017/lr23874.htm</i><br/>]"
23875,2017,"SEC Obtains Judgments Against Dwayne Edwards, Edwards Entities, and Sharon Nunamaker","[On June 9, 2017, the Honorable Esther Salas of the U.S. District Court for the District of New Jersey entered judgments against Dwayne Edwards, several entities Edwards used to orchestrate his alleged fraud, and relief defendant Sharon Nunamaker., The judgment against Edwards and the entity defendants and relief defendants imposes permanent injunctions against future violations of Section 17(a) of the Securities Act of 1933, and Section 10(b) of the Securities Exchange Act of 1934 and Rule 10b-5 thereunder, and aiding and abetting violations of 17(a), 10(b), and Rule 10b-5, a permanent injunction from future participation in municipal securities offerings by Edwards, and orders payment of disgorgement, prejudgment interest thereon, and civil money penalties in amounts to be determined at a later date.  The entity defendants are Senior Solutions of Social Circle, LLC, Oxton Place of Douglas, LLC, d/b/a Oxton Real Estate of Douglas, LLC, Rome ALF, LLC, Savannah ALF, LLC, Gainesville ALF, LLC, Waterford Place ALF, LLC, Montgomery ALF, LLC, Columbus ALF, LLC, and Opelika ALF, LLC, and the relief defendants are Oxton Senior Living, LLC, and Manor House Senior Living, LLC.  The final judgment against Nunamaker orders her to pay disgorgement and prejudgment interest thereon of $7,742.16.  Edwards consented to the entry of the judgment, which continues the receivership over the facilities, on behalf of both himself and his entities.  Nunamaker also consented to the entry of the final judgment., The SECs complaint alleged that Edwards improperly commingled money from several different municipal bond offerings and the revenues of the facilities underlying the offerings.  The offerings allegedly were each supposed to finance a particular assisted living or memory care facility in Georgia or Alabama.  From the funds he commingled, Edwards allegedly diverted investor money for personal use as well as to finance other unrelated bond offerings.  The SEC also alleged that Nunamaker received a portion of these commingled funds from Edwards.  Eight of the nine offerings at issue in the SECs complaint involved the purchase of a facility from Christopher Brogdon, whom the SEC previously sued and obtained a judgment against in connection with a series of similar bond offerings., On January 20, 2017, the day the SEC filed this action, the court issued an order freezing the assets of Edwards and Nunamaker.  The court also appointed a temporary receiver over the facilities underlying the bond offerings and entered judgment as to defendant Todd Barker, Edwards business partner.,  , <i>https://www.sec.gov/litigation/litreleases/2017/lr23875.htm</i><br/>]"
23876,2017,SEC Announces Charges in Oil Well Offering Fraud,"[The Securities and Exchange Commission announced charges against a purported oil well company, its founders, and three salespeople in connection with a $2.4 million offering fraud., The SECs complaint, filed in U.S. District Court for the Central District of California, alleges that from approximately May 2014 to February 2016, Kentucky-Tennessee 50 Wells/400 BBLPD Block, Limited Partnership (K-T 50 Wells) fraudulently offered and sold unregistered securities to investors using a boiler room operation, raising approximately $2.4 million from 41 investors nationwide.  The complaint further alleges that Carol J. Wayland and her son, John C. Mueller, founded and operated K-T 50 Wells and conducted the offering through two other entities that they owned and controlled, HP Operations, LLC and C.A.R. Leasing, LLC.  To solicit investors, Wayland and Mueller allegedly set up a boiler room under the fictitious name of Sahara Wealth Advisors where they employed numerous salespeople, including Mitchell B. Dow, Barry Liss, and Steve G. Blasko, all of whom allegedly had prior experience working in boiler rooms., According to the SECs complaint, K-T 50 Wells was supposed to develop and operate oil wells, but had little legitimate business activity.  Wayland and Mueller allegedly misappropriated K-T 50 Wells investor money for purposes not disclosed in the K-T 50 Wells private placement memorandum, taking at least $871,463, or 36%, to pay for their personal expenses, and using investor money to make Ponzi payments to certain other K-T 50 Wells investors.  The complaint also alleges that K-T 50 Wells made misrepresentations regarding Wayland and Muellers experience managing oil and gas investment projects, as well as the amount of returns that investors would receive., The SECs complaint charges K-T 50 Wells, HP Operations, C.A.R. Leasing, Wayland, and Mueller with violating Sections 17(a)(1) and (3) of the Securities Act of 1933 and Section 10(b) of the Securities Exchange Act of 1934 and Rules 10b-5(a) and (c) thereunder and charges K-T 50 Wells, HP Operations, Wayland, and Mueller with violating Section 17(a)(2) of the Securities Act.  The complaint also charges Wayland and Mueller as control persons of certain of the entity defendants.  In addition, the complaint charges K-T 50 Wells, HP Operations, C.A.R. Leasing, Wayland, Mueller, Dow, Liss, and Blasko with violating Sections 5(a) and 5(c) of the Securities Act and charges Wayland, Mueller, Dow, Liss, and Blasko with violating Section 15(a) of the Exchange Act.  The complaint seeks permanent injunctions, disgorgement plus prejudgment interest, and civil penalties against all of the defendants., The SECs investigation was conducted by Marisa G. Westervelt and Lorraine L. Pearson and supervised by Victoria A. Levin and Rhoda Chang of the Los Angeles Regional Office.  The SECs litigation will be led by Lynn Dean., <img alt= border=0 height=9 src=/images/arrowright_dkblue.gif width=10/><a href=/litigation/complaints/2017/comp23876.pdf>SEC Complaint</a>,  , <i>https://www.sec.gov/litigation/litreleases/2017/lr23876.htm</i><br/>]"
23877,2017,SEC Charges Owner of Convenience Store in Louisiana with Insider Trading,"[The Securities and Exchange Commission today announced fraud charges against Victory Ho for insider trading in the securities of The Shaw Group, Inc. (Shaw), a Louisiana-based energy construction company, ahead of a public announcement on July 30, 2012 that Shaw was going to be acquired by Chicago Bridge &amp; Iron Company N.V., The SECs complaint, filed in the U.S. District Court for the Western District of Louisiana, alleges that during July of 2012, Victory Ho obtained confidential non-public information about the impending Shaw merger. Ho then used all of the money in a newly-opened brokerage account - about $8000 - to purchase 296 Shaw short term call options on Friday, July 27, 2012, the last trading day before the public announcement of the merger.  Prior to purchasing these options, Ho had multiple communications with two individuals who had personal relationships with a Shaw employee who had information concerning the merger. The SEC further alleges that Ho sold the options shortly after the announcement of the acquisition for a profit of approximately $295,000., The SECs complaint charges Ho with violating Section 10(b) of the Securities Exchange Act of 1934 and Rule 10b-5 thereunder and seeks a final judgment imposing a permanent injunction, disgorgement of his profits, pre-judgment interest and a civil penalty., The SECs continuing investigation is being conducted by Louis J. Gicale, Jr. and Ashley Dolan, with the assistance of trial counsel Derek Bentsen, and is being supervised by Melissa A. Robertson., The SEC appreciates the assistance of the Federal Bureau of Investigation, the U.S. Attorneys Office for the Middle and Western Districts of Louisiana, the U.S. Secret Service, the Internal Revenue Service Criminal Investigation, the Options Regulatory Surveillance Authority, and the Financial Industry Regulatory Authority., <img alt= border=0 height=9 src=/images/arrowright_dkblue.gif width=10/><a href=/litigation/complaints/2017/comp23877.pdf>SEC Complaint</a>,  , <i>https://www.sec.gov/litigation/litreleases/2017/lr23877.htm</i><br/>]"
